,Restaurant_Name,Category,Locality,Known_For2,Id
987,Le Chef,"North Indian, Chinese, South Indian, Fast Food, Ice Cream, Beverages"," Cross River Mall, Karkardooma, New Delhi",,988
988,Jack 'N' Chill,"American, Italian, Cafe, Salad"," Vijay Nagar, New Delhi","Strawberry Margarita, Blueberry Shake, Crispy Chicken, Peri Fries, Lasagne, Noodle",989
989,Fill Up,"North Indian, Chinese"," Sector PI, Greater Noida",Good North Indian food with good portions at easy on the pocket prices.,990
990,Pioneer's Flavours of China,"Chinese, Seafood"," Connaught Place, New Delhi","Spicy Wonton, Date Pancake, Fried Prawns, Spicy Chicken, Chinese Platter, Noodle",991
991,Delicieux,"Bakery, Desserts, Chinese, Fast Food, Burger"," Janakpuri, New Delhi",,992
992,Shiv Shankar Dhaba,North Indian," Paschim Vihar, New Delhi","Very Cheap, Pocket Friendly, Portion Size, Tasty Food, Good Food, Quantity",993
993,Fabelle Chocolates - ITC Maurya,"Desserts, Bakery"," ITC Maurya, Chanakyapuri, New Delhi",,994
994,Bombay Blast,"Street Food, Fast Food, Beverages"," Ashok Vihar Phase 2, New Delhi","Masala Pao Bhaji, Tawa Pulao, Dahi Puri, Bhel Puri, Vada Pao, Pav Bhaji",995
995,Cake Bhandar,"Bakery, Desserts"," Sector 62, Noida","Chocolate Almond, Chocolate Coffee, Eggless Cake, Red Velvet Cake Jar, Strawberry Cake, Chocolate Fudge Cake",996
996,Indyaki - Radisson Blu,"North Indian, Mughlai, Desserts"," Radisson Blu, Paschim Vihar, New Delhi","Live Kitchen, Lovely Ambience, Live Music, Amazing Ambience, Excellent Service, Hospitality",997
997,Mad Over Donuts,"Desserts, Beverages"," M Block Market, Greater Kailash 1 (GK1), New Delhi",,998
998,Shawarma Factory,"Arabian, Biryani, Lebanese"," Jaipuria Sunrise Plaza, Indirapuram, Ghaziabad",,999
999,Tunday Kababi,"Lucknowi, Mughlai"," Qutab Plaza, DLF Phase 1, Gurgaon","Mutton Galouti Kabab, Kali Mirch Chicken, Kababs, Chicken Korma, Mutton Biryani, Paratha",1000
1000,Brown Sugar,"Fast Food, Chinese, Bakery, Desserts, North Indian, Beverages"," M Block Market, Greater Kailash 1 (GK1), New Delhi","Wheat Steamos, Chocolate Pie, Chicken Sandwiches, Oreo Shakes, Milkshakes, Smoothies",1001
1001,Karnataka,"South Indian, North Indian, Chinese"," Yusuf Sarai, New Delhi","Upma, Mysore Masala Dosa, Dahi Vada, Filter Coffee, Sambhar, Idli",1002
1002,Vaishno Punjabi Dhaba,North Indian," Prashant Vihar, New Delhi","Cheese Tomato, Tandoori Naan, Paneer Bhurji, Panneer Butter Masala, Malai Kofta, Butter Naan",1003
1003,Ama Thakali,"Nepalese, Chinese"," Majnu ka Tila, New Delhi","Authentic Nepali Food, Aloo Sadeko, Nepali Thali, Mutton Thali, Chicken Curry, Dessert",1004
1004,The Burger Company,"Burger, Fast Food, Beverages"," Global Foyer, Palam Vihar, Gurgaon",,1005
1005,The Coffee Bean & Tea Leaf,"Coffee, Tea, Cafe, Fast Food, Sandwich, Bakery, Desserts, Beverages"," Select Citywalk Mall, Saket, New Delhi","Decaf Coffee, Hazelnut Americano, Mocha Latte, Chocolate Pie, Almond Cake, Dessert Counter",1006
1006,4th Street Cafe,"Fast Food, Beverages, Cafe"," Preet Vihar, New Delhi","Chicken Fried Momos, Peri Fries, White Pasta, Maggie, Salads, Sandwiches",1007
1007,HashStix,"Burger, Momos, Fast Food, Desserts, Beverages"," Sector 15, Faridabad","Kit Kat Shake, Waffle, Chicken Momos, Spring Rolls, Shakes, Chutney",1008
1008,Nirula's,"Fast Food, Pizza, Ice Cream, Beverages, Desserts"," Sushant Lok, Gurgaon","Ice Cream Sundae, Choco Fudge, Sundae, Ice Creams, Dessert, Burgers",1009
1009,Om Sai Ram Andhra Mess,"Biryani, South Indian"," Sector 45, Gurgaon","Andhra Chicken, Plain Rice, Masala Dosa, Chicken Biryani",1010
1010,La Vie Pizzeria,"Pizza, Fast Food, Beverages"," Khan Market, New Delhi","Garden Pizza, Mushroom Soup, Lasagne, Pepperoni Pizza, Bruschetta, Smoothie",1011
1011,Arabian Delites,"Arabian, Fast Food, Wraps, Rolls"," Flyover Market, Defence Colony, New Delhi","Rotisserie Chicken, Chicken Platter, Peri Peri Sauce, Potato Wedges, Falafel, Chicken Shawarma",1012
1012,Madras Cafe,"South Indian, Chinese"," Shahdara, New Delhi","Paneer Uttapam, Vada Sambar, Idli Sambar, Sambhar, Noodle",1013
1013,The Chocolate Villa,"Bakery, Fast Food, Desserts, Beverages"," Crescent Square Mall, Rohini, New Delhi","Chocolate Villa, Sizzling Brownie, Mud Cake, Chocolate Truffle Pastry, Cupcakes, Pastries",1014
1014,Bistro 37,"Cafe, Chinese, Italian, Sandwich, Burger, Beverages, Continental"," Hajipur, Noida","Risotto, Cheesy Fries, Bruschetta, Chicken Sandwich, Sandwiches, Mojito",1015
1015,Anjlika,"Bakery, Fast Food, Rolls, Ice Cream, Desserts, Beverages"," Rajouri Garden, New Delhi","Caramel Fudge, Almond Biscotti, Chocochip Cake, Chicken Tikka Sandwich, Thick Shakes, Cookies",1016
1016,Cake Desire,Bakery," Palam Vihar, Gurgaon","Chocochip Cake, Eggless Cakes, Fresh Fruit Cake, Chocolate Truffle Cake, Pastries",1017
1017,The Regal Kitchen,"North Indian, Chinese, Momos"," Sector 7, Dwarka, New Delhi","Kheer, Kadhai Chicken, Chicken Malai Tikka, Chilli Potato, Paneer Lababdar, Shahi Paneer",1018
1018,Too Indian,"North Indian, Continental"," Rajouri Garden, New Delhi","Mango Sorbet, Nutella Shakes, Chicken Curry Home Style, Paneer Tacos, Veg Tacos, Hummus Pita",1019
1019,Veda,"North Indian, Mughlai, Beverages, Biryani"," Connaught Place, New Delhi",Rohit Bal designed interiors and North Indian spread,1020
1020,Khan Chacha,"North Indian, Mughlai, Rolls, Beverages"," Khan Market, New Delhi","Haryali Roll, Spicy Chicken Roll, Mutton Kakori, Aloo Roll, Khameeri Roti, Chicken Kebab",1021
1021,Al Lazeez,"North Indian, Mughlai, Rolls, Biryani"," Lajpat Nagar 4, New Delhi","Achari Chicken, Keema Gravy, Mughlai Food, Tawa Chicken, Chicken Curry, Naan",1022
1022,Havmor Ice Cream,"Ice Cream, Desserts"," Janakpuri, New Delhi","Chocolate Lollipop, Oreo Overload, Choco Brownie, Ice Creams, Icecream",1023
1023,Breakfast Point,North Indian," Prashant Vihar, New Delhi","Cordial Staff, Economical, Pocket Friendly, Comfort Food, Authentic Taste, Prompt Service",1024
1024,Kake Da Hotel,"North Indian, Mughlai, Rolls, Chinese"," Jail Road, New Delhi","Handi Meat, Rara Meat, Chicken Thali, Paneer Tikka Masala, Soya Chaap, Garlic Naan",1025
1025,Surahi By The Rajkamal,"North Indian, Chinese"," Connaught Place, New Delhi","Deluxe Veggie Burger, Soya Chaap Masala, Spring Roll, Drink, Platter, Soup",1026
1026,The Chinese Hut,"Chinese, Fast Food, Momos"," Aditya City Centre, Indirapuram, Ghaziabad","Crispy Honey Chilli Potato, Pan Fried Noodles, Chicken Soup, Noodles, Starters",1027
1027,Wabi Sabi,"Bakery, Fast Food, Desserts"," Sector 93, Noida","Owner, Great Taste, Price, Value for Money, Experience, Good Quality",1028
1028,Makhani Siingh,"North Indian, Mughlai, Biryani, Rolls"," The Great India Place, Sector 38, Noida","Paneer Masala Biryani, Dum Aloo Kashmiri, Soya Chaap Biryani, Non Veg Biryani, Tandoori Chaap, Jeera Rice",1029
1029,BTW,"North Indian, Street Food, South Indian, Chinese"," Living Style Mall, Jasola, New Delhi","Peda, Sev Puri, Raj Kachori, Tandoori Platter, Vada, Chutneys",1030
1030,Angels In My Kitchen,"Bakery, Fast Food"," Cyber Hub, DLF Cyber City, Gurgaon","Belgian Evasion Cake, Chocolate Evasion, Mocha Pastry, Walnut Pie, Chocolate Croissant, Eclairs",1031
1031,Subway,"Healthy Food, Fast Food, Salad, Wraps"," Vijay Nagar, New Delhi","Veggie Delite, Chicken Kofta, Teriyaki Chicken, Cookies, Salads, Sandwiches",1032
1032,Chinese Veg Crunch,"Chinese, Momos, North Indian"," Rohini, New Delhi","Manchurian Combo, Paneer Noodles, White Pasta, Honey Chilli Potato, Veg Hakka Noodles, Spring Roll",1033
1033,GreeNox Lounge,"Salad, Healthy Food, Juices, Beverages"," Sector 62, Noida","Paneer Salad, Banana Caramel, Chai, Salads, Sandwiches, White Sauce Pasta",1034
1034,Locale,"North Indian, Beverages, Italian, Mughlai"," Saket, New Delhi","Shredded Lamb Burger, Purple Shadow, Molten Chocolate Lava, Veg Extravaganza Pizza, Tiramisu, Falafel",1035
1035,Delhi Barbeque,"North Indian, Street Food, Beverages, Desserts"," Mahipalpur, New Delhi","Pan Kulfi, Fried Prawns, Barbeque, Crispy Corn, Buffet, Panner Tikka",1036
1036,Harish Bakery,"Bakery, Chinese, South Indian, Fast Food, North Indian, Beverages, Street Food, Desserts"," Old Railway Road, Gurgaon","Matar Kulcha, Golgappe, Chowmein, Honey Chilli Potatoes, Sweets, Cakes",1037
1037,Throttle Shrottle,"Cafe, North Indian, Fast Food, Beverages"," Gwal Pahari, Gurgaon","Chai, Tea, Sandwiches, White Sauce Pasta, Pasta, Drinks",1038
1038,Refections- The Juice Bar,"Beverages, Juices, Salad"," Yusuf Sarai, New Delhi","Rose Shake, Orange Mojito, Fried Cheese, Thick Shakes, Kit Kat Shake, Juices",1039
1039,DIOS The Neighbourhood Bistro,"Italian, Continental, Mexican, North Indian"," Sector 132, Noida","Thin Crust Pizza, Mocktails, Brownie, Wings, Corn, Pasta",1040
1040,Eato,"Mughlai, North Indian, Biryani, Chinese"," Sector 50, Gurgaon","Paneer Lababdar, Gulab Jamun, Tandoori Chicken, Dal, Butter Chicken, Soup",1041
1041,Kitchen Clicks,"North Indian, Chinese, Continental"," Indirapuram, Ghaziabad","New Menu, Variety of Pizza, Customizable Dishes, Good Options, Live Music, Weekend Brunch",1042
1042,Mocha Arthouse,"Cafe, North Indian, Continental, Beverages, Desserts, Fast Food"," DLF Promenade Mall, Vasant Kunj, New Delhi","Berry Blast, Shisha, Mocha, Coffees, Maggi, Hot Chocolate",1043
1043,Utsav - Gourmet Cakes and Breads,"Bakery, Desserts, Continental"," Shalimar Bagh, New Delhi","Chocolate Cookies, Choco Truffle, Red Velvet, Pastries, Cakes, Desserts",1044
1044,Delhi Baking Company - JW Marriott New Delhi,"Bakery, Cafe, Fast Food, Healthy Food"," JW Marriott New Delhi, New Delhi","Pastries, Cakes, Sandwiches, Coffee, Chocolate, Desserts",1045
1045,Cinch,"North Indian, Chinese, Continental, Thai, Lebanese, Mexican, Kebab"," Gaur Central  Mall, Raj Nagar, Ghaziabad","Gulkand Ice Cream, Butter Kulcha, Tangdi Chicken, Schezwan Fried Rice, Paneer Tika, Soups",1046
1046,Bruxie,"Burger, Sandwich, Fast Food, Beverages, Desserts"," Ambience Mall, DLF Phase 3, Gurgaon","Fried Chicken Meal, Dessert Waffle, Chicken Tenders, Waffles, Sandwich, Burgers",1047
1047,Instapizza,"Pizza, Fast Food"," Sector 37, Gurgaon","Chicken Sausages, Pepperoni Pizza, Pizzas, Veg Pizza, Brownie, Corn",1048
1048,MOC - The American Restaurant,"Burger, Fast Food, Beverages"," Mayur Vihar Phase 1, New Delhi","Fried Chicken, Peri Peri Fries, Rice Bowl, Chicken Wings, Wrap, Chicken Burger",1049
1049,City Spicee,"North Indian, Chinese"," NIT, Faridabad","Afghani Chaap, Deluxe Thali, Salad, Butter Chicken, Biryani, Momos",1050
1050,Khalsa,"North Indian, Mughlai"," Punjabi Bagh, New Delhi","Bheja Fry, Matka Murgh, Matki Chicken, Afghan Chicken, Tawa Chaap, Fish Tikka",1051
1051,Saffron - Trident Gurgaon,"North Indian, South Indian, Kebab, Mughlai, Beverages, Desserts"," Trident, Udyog Vihar, Gurgaon","Lamb Curry, Laal Maas, Rasmalai, Sweet Dish, Kababs, Thali",1052
1052,Auntie Fung's - Asian Street Food,"Asian, Chinese, Thai, Burmese, Vietnamese, Japanese, Indonesian, Momos"," DLF Galleria, DLF Phase 4, Gurgaon","Bao Bun, Szechwan Chicken, Burmese Khowsuey, Chicken Yakitori, Prawn Noodles, Pho",1053
1053,The Lo-cal Kitchen,"Cafe, Healthy Food, Salad, Wraps, Desserts, Sandwich"," Greater Kailash 1 (GK1), New Delhi","Detox Salad, Whole Wheat Spaghetti, Carrot Juice, Mixed Fruit Juice, Whole Wheat Pasta, Peri Chicken",1054
1054,Gallery Café - Hyatt Place,"Cafe, Asian, North Indian, Desserts"," Hyatt Place Gurgaon, Gurgaon","Dinner Buffet, Sunday Brunch, Waffles, Chole, Salads, Gulab Jamun",1055
1055,Champaran Meat House,"North Indian, Mughlai"," Laxmi Nagar, New Delhi","Economical, Good Crowd, Great Recommendations, Polite Staff, Seating, Good Taste",1056
1056,Mogli's Coffee,"Italian, Continental, Sandwich, Beverages, Cafe, Desserts"," PVR City Centre Mall, MG Road, Gurgaon","Kit Kat Shake, Coffees, Cappuccino, Oreo Shake, Cold Coffee, Shakes",1057
1057,Punjabi Dhaba,North Indian," Rohini, New Delhi","Chana Masala, Malai Kofta, Paneer Butter Masala, Chaap, Dal Makhni",1058
1058,The Chow,"Chinese, Thai, Momos"," Rohini, New Delhi","Tai Chi Chicken, Chicken Dimsums, Hakka Noodles, Spring Rolls, Soup, Chinese Food",1059
1059,Sparrows At Home Cafe,"Cafe, Desserts, Fast Food, Beverages, Pizza, Sandwich, Salad"," Hajipur, Noida","Chocolate Cookies, Walnut Cake, French Toast, Hot Coffee, Pancakes, Cappuccino",1060
1060,Hot & Crusty,"Fast Food, Desserts, Beverages"," Narela, New Delhi","Aloo Tikki Supreme Burger, Fried Cheese, Gravy Momo, Loaded Fries, Kit Kat Shake, Peri Fries",1061
1061,The Flashback,"Italian, Chinese, Continental, American"," Rajendra Place, New Delhi","Garlic Bread with Cheese, Hazelnut Coffee, White Pasta, Grilled Sandwich, Cheesy Fries, Grilled Fish",1062
1062,Excuse Me Boss,"North Indian, Chinese, European, Fast Food, Continental"," MGF Metropolitan Mall, Saket, New Delhi","Maharaja Platter, Tandoori Veg Platter, Grilled Chicken Breast, Cocktail, Virgin Mojito, Chicken Wings",1063
1063,Wangchuk's Tibetan Kitchen,"Tibetan, Chinese, Momos"," Rodeo Drive, Sector 49, Gurgaon, Gurgaon","Chicken Shumai, Authentic Tibetan Food, Steamed Chicken Momo, Tingmo, Momos, Sauce",1064
1064,Zarra Si Biryani,"Biryani, North Indian, Mughlai"," Baani Square, Sector 50, Gurgaon","Egg Biryani, Mutton Biryani, Chicken Malai Tikka, Chicken Biryani, Gulab Jamun, Starter",1065
1065,For God's Cake,Bakery," Gujranwala Town, New Delhi","Potato Twisters, Chocolate Frosting, Eclair Pastry, Gooey Chocolate, Choco Chip Pastry, Snicker Shake",1066
1066,Jain Coffee House,Fast Food," Chandni Chowk, New Delhi","Fruit Sandwich, Veg Sandwich, Cold Coffee, Shakes, Chutney",1067
1067,Play Pizza,"Italian, Fast Food, Beverages, Desserts, Salad, Pasta, Pizza"," Laxmi Nagar, New Delhi","Choco Bomb, Garlic Bread Exotica, Cheese Burst, Paneer Pizza, Pizzas, Veg Pizza",1068
1068,New Sher A Punjab,North Indian," DLF Phase 3, Gurgaon","Panneer Butter Masala, Tandoori Chaap, Kadhai Chicken, Butter Roti, Chilli Potato, Butter Naan",1069
1069,Gourmet Nirvana,"Pizza, Italian, Sandwich, Fast Food, Beverages, Burger"," Sector 37, Noida","Veg Extravaganza Pizza, Sauteed Vegetables, Potato Wedges, Oreo Shake, Sandwich, Garlic Bread",1070
1070,THC - The Hunger Cartel,"Burger, Pizza, Fast Food, Beverages, Continental, Italian, Lebanese"," Shahpur Jat, New Delhi","Spicy Meatballs, Savoury Crepe, Nutella Crepe, Hot Wings, Cappuccino, Potato Wedges",1071
1071,Oh My Gopala,"North Indian, Chinese, Street Food, Biryani"," Connaught Place, New Delhi","Dahi Puri Chaat, Stuffed Capsicum, Golgappa Shots, Pani Puri, Cheese Balls, Butter Roti",1072
1072,Moets Coco Palm,"South Indian, Chettinad, Kerala, Andhra, Seafood, Desserts, Beverages"," PVR City Centre Mall, MG Road, Gurgaon","Seafood Thali, Chettinad Curry, Chicken Dosa, Appam, Mysore Masala Dosa, Dahi Vada",1073
1073,Cafe Garage Inc.,"Chinese, South Indian, Biryani"," Safdarjung, New Delhi","Good Wifi, Weekend Brunch, Student Crowd, Elaborate Menu, Good Music, Customizable Food",1074
1074,Swad-E-Lazeez,"North Indian, Chinese, Mughlai, Biryani"," Amrapali Leisure Valley, Greater Noida","Chicken Tangdi, Achaari Chaap, Dahi Ke Sholey, Egg Curry, Chicken Butter Masala, Afghani Chicken",1075
1075,Mealodrama Modern Bistro,"North Indian, Chinese, Continental, Fast Food, Mughlai"," Rajouri Garden, New Delhi","Crispy Water Chestnut, Corn Poppers, Dahi Sholey, Tex Mex Burger, Chocolate Brownie Sizzler, Cheese Balls",1076
1076,The Shahi Foods,North Indian," Shahdara, New Delhi","Regular Thali, Bhindi Masala, Paneer Dhaniya Adraki, Chole Rice, Mushroom Masala, Paneer do Pyaza",1077
1077,"Squire- ""Shudhh Khao Shudhh Khilao""","North Indian, Chinese, Fast Food"," Sector 72, Noida","Keema Chicken, Mutton Tikka Masala, Keema Meat, Kheer, Chicken Curry, Butter Chicken",1078
1078,Five Star Dhaba,Mughlai," Paschim Vihar, New Delhi","Comfortable Seating Area, Excellent Food, Location, Cafe, Amazing Food, Main Course",1079
1079,One Degree East Cafe,"Chinese, Thai"," Chanakyapuri, New Delhi","Chicken Rara Masala, Lahori Chicken, Handi Paneer, Afghan Chicken, Honey Chilli Potatoes, Malai Chaap",1080
1080,Handi Mittra Di,"Mughlai, North Indian, Chinese, Kebab"," Crossing Republik, Ghaziabad","Bang for the Buck, Cozy Ambiance, Low Price, Prompt Service, Food Taste, Nice Food",1081
1081,Apna Dhaba & Caterers,North Indian," Mayapuri Phase 2, New Delhi","Kathi Rolls, Paneer Roll, Chicken Roll, Tandoori Momos, Butter Chicken",1082
1082,Wonder Taste of Spices,"North Indian, Chinese, Rolls, Mughlai"," Paschim Vihar, New Delhi","Chinese, Asian, Continental, North Indian, Beverages",1083
1083,Cake Innovation,"Bakery, Fast Food"," Sector 7, Gurgaon","Pomegranate Mojito, Masala Corn, Crispy Corn, Sizzlers, Toast, Virgin Mojito",1084
1084,Mystery of Spice,"North Indian, Chinese, Continental"," Hajipur, Noida","Say Cheese Fries, Belgian Fries, Chicken Crisp Burger, Veggie Delight, Loaded Fries, Nutella Waffle",1085
1085,The Belgian Fries Co - Burgers & Fries,"Burger, Fast Food, Continental, American, Belgian, Finger Food, Desserts, Beverages"," MGF Metropolitan Mall, MG Road, Gurgaon","Paneer Kurkure, Tandoori Veg Platter, Mughlai Food, Mutton Rogan Josh, Malai Kofta, Chilly Chicken",1086
1086,Chef Style,"North Indian, Chinese, Rolls"," Sector 53, Gurgaon","Mughlai Food, Shawarma, Kebabs, Chicken Biryani, Mutton, Rolls",1087
1087,Rampur Kitchen,"Rolls, Mughlai, Kebab"," The India Mall, New Friends Colony, New Delhi","Kheer, Mezze Platter, Kulfi, Mocktail, Kebabs, Dessert",1088
1088,CG's - Lounge Cafe Bar,"Continental, North Indian"," Rajouri Garden, New Delhi","Changezi Chicken, Butter Chicken, Tandoori Chicken, Thali, Roll, Biryani",1089
1089,Oliver Kitchen,"North Indian, Pizza, Chinese, Mughlai"," Sector 29, Faridabad","Peach Mocktail, Chicken Sliders, Fried Cheese, Loaded Fries, Peri Peri Fries, Waffles",1090
1090,Khidki,"Burger, Healthy Food, Continental, Fast Food, Desserts, Beverages"," Sector 15, Faridabad","Chicken Sui Mai Dimsum, Chilli Prawns, Thai Red Curry, Dim Sums, Kung Pao Chicken, Honey Chilli Potatoes",1091
1091,The Noodle Company,"Asian, Chinese, Thai"," Supermart 2, DLF Phase 4, Gurgaon","Chocolate Bouquet, Chocolate Desire, Chocolate Overload, Nutella Pancakes, Crepe, Nutella Waffle",1092
1092,Chocolate Desire,"Fast Food, Desserts, Beverages"," Sector 19, Noida","Breakfast, Bar, Server, Main Course, Hospitality, Good Ambience",1093
1093,Riviera,"Continental, North Indian, Chinese, Mediterranean, Fast Food, Beverages"," Ameya Suites, Jasola, New Delhi","Stir Fried Vegetables, Pan Fried Momos, Chilli Mushroom, Veg Manchurian Gravy, Drums of Heaven, Noodle",1094
1094,Hong Kong Express,"Chinese, Thai, Momos"," Raheja Mall, Sohna Road, Gurgaon","Good Valet Service, Loved it, Good Wifi, Fresh Food, Best Food, Student Crowd",1095
1095,Mast Punjabi Chap Corner,"North Indian, Momos, Rolls"," Rohini, New Delhi","Economical, Delivery Time, Good Quality Food, Best Food, Nice Food, Good Service",1096
1096,Ajay Arya Shudh Jaivik Bhojanalaya,North Indian," Sector 19, Faridabad","Reasonable Price, Good Taste, Perfect Place, Packing, Good Food, Good Service",1097
1097,Panditji (Sadar Bazar Wale),North Indian," Rohini, New Delhi","Chocolate Truffle Cake, Tiramisu, Hot Chocolate, Pastries, Cakes, Sandwiches",1098
1098,La Seine - The Chocolate Emporium,"Bakery, Fast Food, Desserts, Beverages"," Green Park, New Delhi","Sophisticated, Live Music, Beautiful Place, Server, Theme, Great Ambiance",1099
1099,Kebabs & Kurries - WelcomHotel Dwarka,"North Indian, Mughlai, Desserts"," WelcomHotel Dwarka, Sector 10, Dwarka, New Delhi","Mocha Frappe, Cappuccino, Hot Chocolate, Salad, Coffee, Pasta",1100
1100,Brick N Bean Cafe,"Italian, Continental, Fast Food, Beverages"," Sector 50, Gurgaon","Chinese, Asian, Continental, North Indian, Beverages",1101
1101,New Gole Hatti,Street Food," West Patel Nagar, New Delhi","Chicken Afghani, Drums of Heaven, Beers, Shahi Paneer, Drink, Soup",1102
1102,Aroma Rest O Bar,"North Indian, Mughlai, Chinese"," Karkardooma, New Delhi","Banana Pudding, Chocolate Muffin, Walnut Pie, Eclair, Dry Cake, Yummy Cake",1103
1103,Giruz,"Cafe, Sandwich, Desserts, Burger, Pizza, Fast Food, Beverages"," Baani Square, Sector 50, Gurgaon","Tandoori Chicken Wings, Peri Peri Fries, Brownie, Momos, Desserts, Shakes",1104
1104,Big Bang City,"Italian, North Indian, Mughlai, Modern Indian"," Janpath, New Delhi","Good Quantity, Portion Size, Great Food, Great Portions, Worth the Money, Price",1105
1105,Noodle Bowl,"Thai, Chinese, Tibetan, Japanese"," Sector 6, Dwarka, New Delhi","Peshawari Chicken, Panneer Butter Masala, Chilli Paneer, Paneer Lababdar, Honey Chilli Potato, Tandoori Chicken",1106
1106,Shibiya Restaurant,"North Indian, Chinese, Mughlai"," Sector 43, Faridabad","Chicken Pesto Sandwich, Mushroom Quiche, Blueberry Cheesecake, Cookies, Chocolate Truffle Cake, Tiramisu",1107
1107,The Coco Company,"Cafe, Bakery, Desserts, Fast Food"," Ninex City Mart Mall, Sohna Road, Gurgaon","Thai Spring Rolls, Jaljeera, Tiramisu, Mocktail, Mushrooms, Chilli Paneer",1108
1108,Foreign Dhaba Express,"Mughlai, North Indian, Continental, Chinese, Thai"," Punjabi Bagh, New Delhi","Potato Wedges, Bacon, Veg Burger, Chicken Burger, Pastas, Salads",1109
1109,Monster's Cafe,"North Indian, Continental, Italian, Chinese, Fast Food"," DLF Phase 4, Gurgaon","Seafood, Cocktail, Sizzlers, Honey Chilli Potatoes, Virgin Mojito, Spring Rolls",1110
1110,Knight,"North Indian, Italian, Chinese, Continental, Seafood, Beverages"," Connaught Place, New Delhi","Veggie Wrap, Chicken Quesadilla, Pesto Pasta, Grilled Sandwich, Bruschetta, Wraps",1111
1111,Fourty Four,"Sandwich, Pizza, Fast Food, Beverages"," Sector 45, Noida","Malai Kofta Curry, Panner Lababdar, Mushroom Masala, Soya Malai Chaap, Paneer Tikka Masala, Tandoori Chaap",1112
1112,Jugaad Kitchen,"North Indian, Chinese, Mughlai, Kebab, Momos"," Sector 31, Gurgaon","Tandoori Chai, Kullad Chai, Chicken Korma, Chicken Malai Tikka, Malai Chaap, Butter Naan",1113
1113,Ustadi,Biryani," Sector 72, Noida","Service and Quality of Food, Excellent Taste, Weekend Brunch, Customizable Food, Family Crowd, Good Music",1114
1114,Nawab's Biryani,"North Indian, Biryani, Mughlai"," Sector 18, Noida","Honey Chilli Fries, Coffee Latte, Belgian Shake, Chicken Lasagna, Dessert Counter, Chocolate Truffle Pastry",1115
1115,Q Bistro,"Cafe, Fast Food, Chinese, Beverages"," Janakpuri, New Delhi","Drunken Chicken, Butter Garlic Prawns, Spring Roll, Dimsums, Soup, Noodles",1116
1116,Empress Of China - Eros Hotel,"Chinese, Seafood, Desserts"," Eros Hotel, Nehru Place, New Delhi","Courteous Service, Decor, Good Ambience, Interior, Courteous Staff, Owner",1117
1117,Clip Kitchen,"Chinese, Italian, Continental, Asian, North Indian, Beverages"," Raj Nagar, Ghaziabad","Afghani Chaap, Kheer, Paneer Butter Masala, Kadhai Paneer, Tandoori Chicken, Butter Naan",1118
1118,The Second Wife Restaurant,"North Indian, Mughlai, Chinese, Fast Food"," Hajipur, Noida","Nutella Dosa, Sweet Dosa, Cheese Uttapam, Chocolate Dosa, Filtered Coffee, Mysore Masala Dosa",1119
1119,The Great Indian Dosa,South Indian," Delhi University-GTB Nagar, New Delhi","Banarasi Chaat, Pani Puri, Raj Kachori, Jalebi, Chole Bhature, Chilli Garlic Noodles",1120
1120,Delhi - Kingdom of Dreams,"North Indian, Street Food"," Kingdom of Dreams, Sector 29, Gurgaon","Good Quantity, Awesome Food, Owner, Great Food, Cafe, Good Service",1121
1121,Momopoly By Little Skillet,"Chinese, Fast Food, North Indian, Momos"," Sector 49, Gurgaon","Red Velvet Waffle, Cheese Bomb, Peri Fries, Waffle, White Sauce Pasta, Hot Chocolate",1122
1122,Mad Drop,"Burger, Pizza, Rolls, Sandwich, Fast Food, Desserts, Beverages"," Sector 21, Faridabad","Molten Chocolate Lava, Classic Margherita Pizza, Cheese Garlic Bread, Peri Peri Fries, Hummus, Nachos",1123
1123,Hudson Oven,"Cafe, Pizza"," Delhi University-GTB Nagar, New Delhi","Thick Shakes, Mixed Sauce Pasta, Mojito, Oreo Shake, Sandwiches, Burgers",1124
1124,Winkies,"Fast Food, Beverages"," Kavi Nagar, Ghaziabad","Chilli Potato Pops, Mushroom Chilli, Egg Noodles, Puri Sabzi, Masala Chaap Roll, Tandoori Chicken Wings",1125
1125,Chandni Chowk To Galwan Valley,"North Indian, Mughlai, Chinese, Biryani, Fast Food, Desserts"," DLF Phase 4, Gurgaon","Pancakes, Waffles, Mojito, Paneer Lababdar, Soya Chaap, Spring Rolls",1126
1126,Maestro,"Cafe, Italian, North Indian, Chinese"," Ashok Vihar Phase 1, New Delhi","Handi Dal, Soya Tikka, Tandoori Chaap, Lassi, Malai Chaap, Paneer Tikka",1127
1127,Kamal's,"North Indian, Fast Food, Street Food, Mithai, Beverages"," Sunder Nagar, New Delhi","Lusty Chicken Burger, Chicken Garlic Bread, Keema Kulcha, Chicken Sandwich, Peri Peri Fries, Red Sauce Pasta",1128
1128,Munch Nation,"North Indian, Chinese, Fast Food"," Ashok Vihar Phase 3, New Delhi","Hyderabadi Chicken, Briyani, Tawa Chicken, Veg Biryani, Egg, Paneer Butter Masala",1129
1129,Biryani By Moumita Biryani Pal,"Biryani, North Indian"," Palam, New Delhi","Pinni, Puri Chole, Barfi, Gajar Halwa, Jalebi, Lassi",1130
1130,Standard Burfee,"Mithai, Street Food"," Karol Bagh, New Delhi","Highly Recommended, Hygienic, Weekend Brunch, Cute Packaging, Student Crowd, Family Crowd",1131
1131,New Udupi Restaurant,"South Indian, Chinese"," Nehru Nagar, Ghaziabad","Gosht Roganjosh, Changezi Chicken, Phirni, Paneer Makhani, Mughlai Food, Soya Chaap",1132
1132,Cafe Purani Dilli,"North Indian, Mughlai, Biryani"," Punjabi Bagh, New Delhi","Sweet Corn Soup, Chilly Garlic Noodles, Veg Noodles, Chilly Chicken, Chicken Momos, Spring Rolls",1133
1133,Chinese Corner,Chinese," Vyapar Kendra, Sushant Lok, Gurgaon","Cheeseless Pizza, Couscous Salad, Spinach Corn Sandwich, Healthy Breakfast, Smoothies, Steak",1134
1134,The Diet Kitchen,"Continental, Healthy Food, Salad"," East Patel Nagar, New Delhi","Chocolate Truffle, Pastas, Pizzas, Chicken Wings, Cakes, Dessert",1135
