,Restaurant_Name,Category,Locality,Known_For2,Id
1423,Mom's Kitchen,"North Indian, Chinese, Momos, Rolls, Fast Food, Bengali"," Chittaranjan Park, New Delhi","Chinese, Great Recommendations, Preparation, Portion, Great Taste, Best Place",1424
1424,The Dim Sum House,"Chinese, Thai, Continental, Momos, Fast Food"," Rodeo Drive, Sector 49, Gurgaon, Gurgaon",,1425
1425,Frontier - The Ashok,"North Indian, Mughlai"," The Ashok, Chanakyapuri, New Delhi","Chilli Paneer Dry, Panneer Butter Masala, Kadhai Paneer, Shahi Paneer, Dal Makhani, Paneer Tikka",1426
1426,Baraamda,"Chinese, North Indian, Mughlai, Desserts, Beverages"," Sector 72, Noida","Relaxed Atmosphere, Comfortable Seating Area, Main Course, Ambiance, Prices, Delicious Food",1427
1427,The Grills Food Junction,"North Indian, Chinese, Mughlai, Biryani, Beverages"," Old Railway Road, Gurgaon","Reshmi Murgh, Firni, Mutton Biriyani, Chicken Handi, Chicken Biriyani, Egg Biryani",1428
1428,Aminia,"North Indian, Mughlai, Rolls, Biryani"," Chittaranjan Park, New Delhi","Stuffed Malai Chaap, Panner Butter Masala, Gulab Jamun, Dal Makhni, Paneer Tikka",1429
1429,Shudh Vaishno Hotel,North Indian," Karampura, New Delhi","Matka Murgh, Matki Chicken, Chicken Soup, Chicken Biryani, Butter Chicken",1430
1430,Bawa's The Journey Of Spice,"North Indian, Mughlai, Chinese, Kebab, Rolls"," Kirti Nagar, New Delhi","Tornado Potato, Banana Nutella, Crepes, Brownie Waffle, Chocolate Waffle, Pancake",1431
1431,Waffles & Crepes,"Desserts, Beverages"," Sector 37, Noida","Gravy Momo, Chilli Mushroom, Veg Roll, Chilli Garlic Noodles, Chicken Fried Rice, Egg Roll",1432
1432,Golden China Hut,"Chinese, Burger, Momos, Rolls"," Safdarjung, New Delhi","Prompt Service, Tasty Food, Music, Good Place, Worth the Money, Good Food",1433
1433,Dosa Plaza,"South Indian, Chinese, North Indian, Beverages"," Shahdara, New Delhi","Teekha Paneer, Chicken Salami Sandwich, Open Sandwich, Sandwiches, Pizzas",1434
1434,Caffé La Poya,"Fast Food, Sandwich, Italian"," Sector 30, Noida","Mud Cake, Carrot Cake, Coffees, Pancakes, Cappuccino, Hot Chocolate",1435
1435,Coffee House,"Cafe, Fast Food"," Majnu ka Tila, New Delhi","Good for Families, Breakfast, Nice Place, Quality, Experience, Taste",1436
1436,Grover Mithaivala,"Mithai, Street Food, North Indian, Desserts"," Jail Road, New Delhi","Veg Combo Platter, Chicken Shawarama, Barbeque Chicken, Soya Chaap Roll, Paneer Tikka Pizza, Shawarma",1437
1437,The Munchin Co.,"Italian, North Indian, Chinese, Mughlai, Fast Food, Rolls"," Vyapar Kendra, Sushant Lok, Gurgaon","Owner, Great Place, Quantity, Prices, Delicious Food, Ambience",1438
1438,Peshawari Chicken Corner,North Indian," Karol Bagh, New Delhi","Shehnai Chicken, Mughlai Food, Malai Kofta, Tandoori Chicken, Tikka, Dal Makhani",1439
1439,Mughal Darbar,"North Indian, Mughlai"," Punjabi Bagh, New Delhi","Naga Pork Thali, Pork Rib, Chicken Dry Fry, Pork Fry, Pork Chilli, Chicken Thali",1440
1440,Bamboo Hut,Naga," Mukherjee Nagar, New Delhi","Variety of Pizza, Beautiful Ambience, View, Beautiful Place, Outdoor Seating, Weekend Brunch",1441
1441,VU The Penthouse Bar,"Modern Indian, European, Asian, Italian, Beverages"," Nehru Place, New Delhi","Ambiance, Food Quality, Spicy, Main Course, Great Place, Great Food",1442
1442,Uncle's,"North Indian, Mughlai, Chinese"," Sector 11, Noida","Veg White Sauce Pasta, Mushroom Sandwich, Wraps, Sandwiches, Burgers, Pasta",1443
1443,Fit Food 27,"Healthy Food, Fast Food, Beverages"," Sector 27, Noida","Continental, Italian, Fast Food, North Indian, Beverages, Coffee",1444
1444,Rule The Rolls,"Rolls, North Indian, Kebab, Beverages"," Sector 15, Gurgaon","Macaroons, Cup Cakes, Cupcakes, Hot Chocolate, Coffees, Tiramisu",1445
1445,Choko La,"Bakery, Desserts"," Khan Market, New Delhi","Deluxe Veggie Pizza, Capsicum Pizza, Stuffed Garlic Bread, Paneer Pizza, Mixed Sauce Pasta, Pizzas",1446
1446,Pizza81,"Pizza, Fast Food"," Preet Vihar, New Delhi","Hazelnut Brownie, Vegetable Dimsums, Meal Box, Quick Meal, Hakka Noodles",1447
1447,Wok To Walk,"Chinese, Asian, Beverages"," Defence Colony Main Market, Defence Colony, New Delhi","Veg Galauti, Mutton Galouti Kabab, Dahi Kabab, Paneer Lababdar, Paneer Tikka, Dal Makhni",1448
1448,Kasbah Forum,"North Indian, Mughlai"," Greater Kailash 2 (GK2), New Delhi","Spicy Vada Pav, Vada Pao, Pao Bhaji, Pulao, Dosa, Salad",1449
1449,Jhakkas Pav Bhaji Mumbai Wala,"Street Food, South Indian"," Rohini, New Delhi","Chicken Shawarama, Malai Chaap Roll, Panneer Butter Masala, Shawarma, Afghani Chicken, Kabab",1450
1450,The Delhi Munchery,"North Indian, Mughlai, Lebanese, Fast Food"," Mayur Vihar Phase 1, New Delhi","Low Price, Polite Staff, Seating, Food Quality, Value for Money",1451
1451,Madras Cafe,"South Indian, Chinese"," Rohini, New Delhi","Chocolate Hazelnut Cake, Mango Pastry, Vanilla Cake, Fresh Fruit Cake, Chocolate Truffle, Red Velvet",1452
1452,Box Of Cake,"Bakery, Fast Food, Desserts, Beverages"," Sector 35, Faridabad","Veg Crisp Burger, Lemon Soda, Loaded Fries, Wraps, Burger, Shakes",1453
1453,Burger Ji,"Burger, Fast Food, Beverages"," Sector 49, Gurgaon","Chocolate Souffle, Tiramisu Jar, Dry Cake, Banoffee Pie, Cheese Cake, Pastries",1454
1454,Fuchsia Bakery & Patisserie,"Bakery, Desserts"," Baani Square, Sector 50, Gurgaon","Spanner Wings, Meat Orgy, Vodka Chicken, Sausage, Peri Fries, Sangria",1455
1455,Garage Inc.,"Continental, American, Italian, Salad"," Hauz Khas Village, New Delhi","Rooftop Ambience, Cozy, Cafe, Courteous Staff, Decor, Portion Size",1456
1456,DeliBombay Cafe & Delicatessen,"Cafe, Fast Food, Desserts, Beverages, Italian"," Community Centre, New Friends Colony, New Delhi","Afghan Chicken, Chilli Mushroom, Chilly Paneer, Mocktails, Hakka Noodles, Dessert",1457
1457,Crops & Curries,"North Indian, Chinese, Mediterranean, Italian"," Raj Nagar, Ghaziabad","Stuffed Garlic Bread, Paneer Pizza, Pizzas, White Sauce Pasta",1458
1458,Your's Pizza,"Pizza, Fast Food, Pasta"," Raj Nagar, Ghaziabad","Chur Chur Naan Thali, Karahi Paneer, Matar Mushroom, Panneer Butter Masala, Tawa Roti, Sahi Paneer",1459
1459,Apni Rasoi,"North Indian, Chinese, Momos, Desserts, Beverages"," Mukherjee Nagar, New Delhi","Poha, Samosa, Tandoori Momos, Sandwiches, Shakes, Burgers",1460
1460,Fu.D,"Continental, Beverages, Sandwich, North Indian, Fast Food"," Sushant Lok, Gurgaon","Veggie Crunch, Paneer Dhokla, Dry Cake, Pastries, Sweets, Cakes",1461
1461,Manohar Cakes & Bikaneri,"Mithai, Bakery, Fast Food, Chinese"," Vijay Nagar, New Delhi","Good Wifi, Student Crowd, Elaborate Menu, Young Crowd, Customizable Food, Fresh Food",1462
1462,Aggarwal Sweet India,"Mithai, Street Food"," Mukherjee Nagar, New Delhi","Baked Samosa, Blueberry Pastry, Fresh Fruit Cake, Pastries, Chocolate Truffle, Cakes",1463
1463,Sir John Bakery Cafe,"Bakery, Fast Food, Chinese, Beverages"," Indirapuram, Ghaziabad","Plenty of Vegetarian Options, Cordial Staff, Casual Seating Area, Cute Little Place, Comfort Food, Great Recommendations",1464
1464,Jacket Aloo,"Fast Food, Rolls, Burger, Pizza, Sandwich, Pasta, Beverages"," Rodeo Drive, Sector 49, Gurgaon, Gurgaon","Seating, Good Food, Prices, Quantity, Service, Taste",1465
1465,Suvidha Vegetarian,North Indian," Daryaganj, New Delhi","Chilli Garlic Bread, Choco Lava Cake, Pastas, Pizzas, White Sauce Pasta, Sauce",1466
1466,Pizza AH!,"Pizza, Fast Food, Beverages"," Palam, New Delhi","Soups, Chicken Momos, Noodle, Momo, Spring Rolls, Chinese Food",1467
1467,The Chinese Kitchen,"Chinese, Seafood, Thai"," Sector 15, Gurgaon","Great Lighting, Worth the Price, Live Music, Courteous Staff, Great Service, Friendly Staff",1468
1468,Paatra - Jaypee Siddharth,North Indian," Jaypee Siddharth, Rajendra Place, New Delhi","Molten Lava Cake, Dessert, Drinks, Snacks, Dal Makhani, Sauce",1469
1469,Hyjack,"Asian, Continental, North Indian"," Safdarjung, New Delhi","Masala Momo, Drums of Heaven, Tawa Chicken, Tandoori Momos, Soups, Butter Naan",1470
1470,Singh Ching,"North Indian, Mughlai, Asian"," Delhi University-GTB Nagar, New Delhi","Boondi Raita, Noodle, Mutton Rogan Josh, Malai Chaap, Paneer Lababdar, Chicken Momos",1471
1471,Heaven's Kitchen,"North Indian, Chinese, Biryani, Mughlai, Rolls, Momos, Fast Food, Beverages"," Kalkaji, New Delhi","Relaxed Atmosphere, Good Ambience, Ambiance, Nice Place, Staff, Quality",1472
1472,Pizza Hut,"Pizza, Fast Food, Desserts"," Ansal Plaza Mall, Palam Vihar, Gurgaon","Bang for the Buck, Cute Little Place, Lip Smacking Food, Good Portions, Good Crowd, Casual Seating Area",1473
1473,New Punjabi Dhaba,North Indian," Rohini, New Delhi","View, Great Service, Manager, Decor, Ambiance, Presentation",1474
1474,Paatra - Jaypee Greens Golf & Spa Resort,North Indian," Jaypee Greens Golf & Spa Resort, Surajpur, Greater Noida","Pineapple Curry, Vindaloo, Mushroom Galauti, Butter Garlic Prawns, Shahi Tukda, Tacos",1475
1475,1440 - 24 Hrs Cafe,"Kebab, BBQ, Middle Eastern, North Indian"," Park Inn by Radisson, Lajpat Nagar 4, New Delhi","White Forest Cake, Choco Truffle Cake, Red Velvet Cake, Cheesecake, Chocolate",1476
1476,The Cake House,"North Indian, Bakery"," Sector 72, Noida","Good Wifi, Elaborate Menu, Good Music, Student Crowd, Customizable Food, Young Crowd",1477
1477,Desi Corridor,"North Indian, Chinese, Fast Food"," Sector 53, Gurgaon","Choco Fudge Brownie, Mushroom Patty, Choco Truffle Cake, Quiche, Cheese Cakes, Blueberry Cheesecake",1478
1478,Open Oven Bakehouse,"Bakery, Desserts, Fast Food, Beverages"," Greater Kailash 2 (GK2), New Delhi","Good Taste, Great Taste, Good Food, Quality, Ambience, Staff",1479
1479,K.K. Family Restaurant,"Chinese, North Indian, Mughlai"," Tagore Garden, New Delhi","Paneer Patty, Chocolate Truffle, Pastries, Cakes, White Sauce Pasta, Snacks",1480
1480,Big Bake,"Chinese, Fast Food, Bakery"," Pitampura, New Delhi","Continental, Italian, Fast Food, North Indian, Beverages, Coffee",1481
1481,The Oberoi Patisserie And Delicatessen,"Bakery, Desserts, Fast Food"," The Oberoi, Udyog Vihar, Gurgaon","Paneer Sandwich, Thick Shakes, Veg Burger, Cold Coffee, Rolls, Garlic Bread",1482
1482,Scoops,"Pizza, Burger, Fast Food, Ice Cream, Desserts, Beverages"," Uttam Nagar, New Delhi","Wheat Momo, Steamed Chicken Momos, Pan Fried Momos, Soup",1483
1483,Momo Queen,"Momos, Tibetan, Chinese"," Vasant Kunj, New Delhi","Vada Sambar, Mysore Masala Dosa, Sambhar, Dosa, Chowmein",1484
1484,Muttu South Indian Anna,"South Indian, Chinese"," Lajpat Nagar 4, New Delhi","Milk Pudding, Coconut Shake, Milkcake, Molten Cake, Sweet Lime, Craft Beer",1485
1485,Inferno Brewpub,"North Indian, Chinese, Continental, Italian"," Sector 29, Gurgaon","Masala Chaap Roll, Panneer Butter Masala, Panner Tikka, Veg Fried Rice, Chilli Potatoes, Hakka Noodles",1486
1486,Invitation Restaurant,"North Indian, Fast Food, Chinese, South Indian"," Sector 86, Faridabad","Great Concept, Excellent Food, Quick Service, Combo, Tasty, Portion",1487
1487,Wok Me,"Chinese, Asian"," Hauz Khas, New Delhi","Mouth Watering Food, Owner, Good Service, Good Food, Good Place, Delicious Food",1488
1488,Patiala Shahi,"North Indian, Mughlai"," Rohini, New Delhi","Rainbow Roll, Poke Bowl, Spicy Salmon, Asparagus Tempura, Sushi, Dimsums",1489
1489,Tobiko By Enoki,"Asian, Chinese, Japanese, Thai, Sushi, Poké"," DLF Phase 4, Gurgaon","Fast Delivery, Excellent Food, Reasonable Price, Owner, Portions, Good Food",1490
1490,Freedom Corner,"Chinese, Tibetan, Momos, Nepalese, Seafood"," Safdarjung, New Delhi","Cute Little Place, Prompt Service, Reasonable Prices, Worth the Money, Value for Money, Ambience",1491
1491,Flavours Of Southwala,"South Indian, Fast Food, Chinese, Beverages"," Laxmi Nagar, New Delhi","Excellent Food, Excellent Service, Good Ambience, Awesome Food, Courteous Staff, Presentation",1492
1492,La Brezza - Jaypee Greens Golf & Spa Resort,Italian," Jaypee Greens Golf & Spa Resort, Surajpur, Greater Noida","Creamy Tomato Soup, Sweet Corn Soup, Honey Chilli Potatoes, Sizzler, Hakka Noodles, Malai Kofta",1493
1493,Ashirwad Restaurant,"North Indian, South Indian, Chinese, Beverages"," Sector 16, Faridabad","Afghan Chicken, Panneer Butter Masala, Noodle, Butter Roti, Hakka Noodles, Kadhai Paneer",1494
1494,Nosher's Kitchen,"Fast Food, Chinese, North Indian"," Gaur City 1, Greater Noida","Excellent Food, Interior, Excellent Service, Hospitality, Portions, Amazing Food",1495
1495,Tsui Wong,"Thai, Asian, Chinese"," East Patel Nagar, New Delhi","Romantic Place, Preparation, Decor, Good Music, Perfect Place, Presentation",1496
1496,Gigi Bistro Indiano,"North Indian, Mediterranean, Asian, Chinese, Italian"," DLF Phase 3, Gurgaon","Dj, Nice Ambience, Music, Amazing Place, Decor, Good Service",1497
1497,The Royale,"North Indian, Continental, Chinese"," Hajipur, Noida","Kadai Paneer, Paneer Butter Masala, Thali, Shahi Paneer, Chicken Biryani, Chaap",1498
1498,Malhotra's Zayeeka,"North Indian, Mughlai, Chinese, Momos, Rolls"," Moti Nagar, New Delhi","Malai Momo, Paneer Naan, Manchurian Dry, Veg Fried Rice, Tomato Soup, Tandoori Momos",1499
1499,Foodelicious,"North Indian, Chinese, Mughlai, Momos"," Sector 56, Noida","Pocket Friendly, Prompt Service, Decent Place, Reasonable Price, Nice Food, Environment",1500
1500,Tau's Cafe & Lassi Bar,"North Indian, Fast Food, Rolls, Chinese, Beverages"," Ansal Plaza Mall, Palam Vihar, Gurgaon","Nutella Pie, Potato Twister, Choco Mud, Cupcakes, Pastries, Shakes",1501
1501,For God's Cake,"Bakery, Street Food, Fast Food"," Paschim Vihar, New Delhi","Fried Rice Chicken, Kathi Rolls, Chicken Roll, Raita, Chicken Biryani",1502
1502,Khan's Kathi Rolls,"Rolls, Hyderabadi, Chinese"," Gamma 1, Greater Noida","Economical, Casual Seating Area, Polite Staff, Great Taste, Tamper Proof Packaging, Food Presentation",1503
1503,Laddu Gopal,"North Indian, Chinese"," Old Railway Road, Gurgaon","Chirpy Crowd, Comfort Food, Pocket Friendly, Great Ambiance, Polite Staff, Prompt Service",1504
1504,A One Chicken Biryani Corner,"Biryani, Mughlai"," NIT, Faridabad","Low Price, Great Recommendations, Quantity, Food, Taste, Service",1505
1505,Twist of Italy,"Italian, Fast Food, Beverages"," Sector 37, Faridabad","Rajasthani Thali, Churma, Masala Tea, Jalebi, Dal, Rice",1506
1506,The Tomato Restaurant,"North Indian, Rajasthani, Sandwich"," DLF Phase 4, Gurgaon","Good Portions, Seating Arrangement, Contactless Delivery, Elaborate Menu, Wonderful Presentation, Proper Packaging",1507
1507,Namcha,"Naga, Nepalese, Tibetan"," Vasant Kunj, New Delhi","Pesto Fuel, Chicken Double Decker, Beetroot Hummus, Whole Wheat Wrap, Smoothies, Juices",1508
1508,Nutritious Nation,"Healthy Food, Sandwich, Burger, Continental"," Greater Kailash 2 (GK2), New Delhi","Bedmi Poori, Bread Pakora, Jalebi, Lassi, Kachori, Panneer Butter Masala",1509
1509,Gopal Foods,"North Indian, Chinese"," Kamla Nagar, New Delhi","Mozzarella Cheese Sticks, Chicken Strips, Burgers, White Sauce Pasta, Pizzas, Sauce",1510
1510,Serve,"Fast Food, Beverages"," Sector 37, Noida","Concept, Courteous Staff, Great Place, Ambiance, Good Food, Prices",1511
1511,Baked Pizza & Co.,"Pizza, Italian, Beverages, Pasta"," Greater Kailash 1 (GK1), New Delhi","Soya Chaap Roll, Wraps, Chicken Roll, Paneer Roll, Tandoori Momos, Rolls",1512
1512,Wraps Kathi Rolls,"Rolls, Wraps, Chinese, Lebanese, Fast Food"," Karol Bagh, New Delhi","Good Value, Good Quality Food, Quick Service, Packing, Good Service, Prices",1513
1513,Kathi Junction,"Rolls, North Indian, Biryani, Beverages"," MSX Mall, Jaypee Greens, Greater Noida, Greater Noida","Nutella Crunch, Brownie Waffle, Corn Sandwich, Nutella Waffle, Cheesy Fries, Waffles",1514
1514,The Waffle House,"Desserts, Fast Food"," Raj Nagar, Ghaziabad","Coffee Hazelnut, Fried Cheese, Choco Brownie, Peri Fries, Chicken Popcorn, Cappuccino",1515
1515,Cafe NYC Queens,"Beverages, Coffee, Continental"," Kalkaji, New Delhi","Dragon Rolls, Momos Platter, Noodle, Chilli Paneer, Spring Rolls, Chilli Chicken",1516
1516,Hungry Chow,"Chinese, Thai"," Sector 45, Noida","Economical, Great Recommendations, Polite Staff, Hospitality, Owner, Price",1517
1517,Pizzaiolo,"Italian, Pizza, Pasta, Salad, Desserts"," Sector 49, Gurgaon","Awesome Food, Good Taste, Great Taste, Main Course, Best Place, Prices",1518
1518,Swastik Pure Veg,"North Indian, Chinese"," Sector 23, Dwarka, New Delhi","Continental, Italian, Fast Food, North Indian, Beverages, Coffee",1519
1519,Cannoli Royale,"Bakery, Fast Food, Desserts"," Paschim Vihar, New Delhi","Kathi Rolls, Egg Roll, Paneer Roll, Tandoori Momos, Burgers",1520
1520,Nazim's Kathi Roll,"Rolls, Burger, Momos, North Indian"," Sector 14, Gurgaon","Noodle, Chilli Potatoes, Chicken Momos, Spring Roll, Chinese Food",1521
1521,China Chowk,"Chinese, Fast Food, Momos"," West Patel Nagar, New Delhi","Amchi Vada Pav, Meerut Shikanji, Anda Bun, Kutchi Dabeli, Samosa Pav, Thepla",1522
1522,Nukkadwala,"Fast Food, Street Food, Beverages"," Sohna Road, Gurgaon","Chicken Hydrabadi Biryani, Chicken Korma, Rumali Roti, Tandoori Roti",1523
1523,A One Chicken Biryani,"Salad, Beverages"," Janakpuri, New Delhi","Exotic Shawarma, Manakeesh, Falafel Shawarma, Hummus, Salads, Roll",1524
1524,Shish Shawarma,"Arabian, Fast Food, Pizza, Beverages"," Community Centre, New Friends Colony, New Delhi","Brain Masala, Tawa Chicken, Mutton, Butter Chicken, Breads, Dal Makhani",1525
1525,Wah! Amritsar,"North Indian, Mughlai, Chinese"," Supermart 2, DLF Phase 4, Gurgaon","Chocolate Yogurt, Blueberry Yogurt, Strawberry Ice Tea, Alfredo Pasta, Waffles, Sandwiches",1526
1526,Red Mango,Cafe," Ambience Mall, Vasant Kunj, New Delhi","Pancakes, Waffle, Wraps, Oreo Shake, Sandwiches, Burgers",1527
1527,Max's Cafe,"Burger, Rolls, Pizza, Sandwich, Wraps, Fast Food, Beverages, Desserts"," Alpha 2, Greater Noida","Nutella Brownie Waffles, Ferrero Rocher Waffle, Nutella Pancake, Red Velvet Waffle, Belgium Chocolate, Chocolate Waffle",1528
1528,Waffle Fever Cafe,"Fast Food, Desserts"," Sector 14, Gurgaon","Chocolate Truffle Cake, Tiramisu, Pastries, Cakes, Coffee, Snacks",1529
1529,TADO - The Artisan Deli and Oven,Cafe," Vivanta by Taj, Suraj Kund, Faridabad","Chicken Overload Pizza, Veg Alfredo Pasta, Peri Peri Pizza, Cheesecake, Pizzas, Nachos",1530
1530,Rayna's Cafe,"Cafe, Fast Food, Pizza, Italian, Desserts, Beverages"," Safdarjung, New Delhi","Bubble Gum Ice Cream, Mississippi Mud, Banana Split, Belgian Chocolate, Chocolate Fudge, Sundae",1531
1531,Baskin Robbins,"Ice Cream, Desserts, Beverages"," Sector 62, Noida","Cute Little Place, Amazing Ambience, Reasonable Prices, Prompt Service, Polite Staff, Friendly Staff",1532
1532,Mag 'n' Cheese,Fast Food," Kamla Nagar, New Delhi","Kesar Kulfi Faluda, Chocolate Fudge, Ice Creams, Dessert",1533
1533,Giani,"Ice Cream, Desserts, Bakery, Beverages"," Vasant Vihar, New Delhi",,1534
1534,Kay's Chicken Corner,"Mughlai, North Indian, Kebab"," Pitampura, New Delhi",,1535
1535,Moti Dhaba,North Indian," Shalimar Bagh, New Delhi","Seating Capacity, Family Restaurant, Cleanliness, Portion Size, Food Quality, Prices",1536
1536,Sugandh,North Indian," Daryaganj, New Delhi","Continental, Italian, Fast Food, North Indian, Beverages, Coffee",1537
1537,Mr.Singh  Pishori Chicken Corner,North Indian," Sector 49, Gurgaon","Egg Kathi Roll, Chicken Shawarama, Panneer Butter Masala, Afghani Chicken, Kadai Paneer, Chowmein",1538
1538,Anand Curry Delite,"North Indian, Mughlai, Chinese, Fast Food, Momos, Rolls"," PVR Anupam Complex, Saket, New Delhi","Spice Chicken, Vegetable Spring Rolls, Thai Green Curry, Chicken Spring Roll, Chicken Hakka Noodles, Pan Fried Noodles",1539
1539,Street Monk - Gourmet Pan Asian,"Chinese, Asian"," Sector 30, Gurgaon","Capsicum Pizza, Stuffed Garlic Bread, Veg Pizza, Pizzas, Corn, Mushroom",1540
1540,The Red Pepper,Pizza," Vasundhara, Ghaziabad","Punjabi Tadka Maggi, Brownie Waffle, Chocolate Waffle, Waffles, Pancake, Peri Peri Fries",1541
1541,#Waffles,"Desserts, Ice Cream, Fast Food, Beverages"," Geeta Colony, New Delhi","Achari Chaap, Chilly Potato, Mojito, Malai Chaap, Hakka Noodles, White Sauce Pasta",1542
1542,Anjuna Garden,"Cafe, North Indian, Chinese"," Raj Nagar, Ghaziabad",,1543
1543,Vaishno Snacks Corner,North Indian," IP Extension, New Delhi","Chilli Garlic Bread, Choco Lava, Pizzas, White Sauce Pasta, Burgers",1544
1544,Classic Pizza Everyday,"Pizza, Fast Food, Beverages"," Krishna Nagar, New Delhi","Themed Decor, Relaxed Atmosphere, Tandoori, Preparation, Reasonable Price, Nice Ambience",1545
1545,Northern Delights,"North Indian, Mughlai, Chinese, Rolls"," Indirapuram, Ghaziabad","Egg Sandwich, Dessert Counter, Shakes, Burgers, Fries, Snacks",1546
1546,Cafe 31,"Street Food, Fast Food, Sandwich, Burger, Italian, Pizza, Desserts, Beverages"," Sector 31, Gurgaon","Thick Shake, Waffles, Brownie, Sandwiches, Cakes, Burger",1547
1547,Cafe Maple Street,"Cafe, Bakery, Fast Food, Desserts, Beverages"," Sector 49, Gurgaon","Chirpy Crowd, Casual Seating Area, Good Portions, Cute Little Place, Amazing Staff, Prompt Service",1548
1548,Black Buck's Coffee,"Fast Food, Beverages"," DLF Cyber City, Gurgaon","Office Crowd, Casual Seating Area, Elegantly Decorated, Cordial Staff, Lip Smacking Food, Economical",1549
1549,Spice Punch Bistro,"North Indian, Chinese, Fast Food, Momos, Beverages"," Rohini, New Delhi","Malai Chaap, Tandoori Roti, Kadhai Paneer, Butter Naan, Rolls, Butter Chicken",1550
1550,Zaika Of Purani Dilli,"North Indian, Chinese, Mughlai, Biryani"," Sector 72, Noida","Plenty of Vegetarian Options, Lip Smacking Food, Good Crowd, Great Recommendations, Inexpensive, Great Ambiance",1551
1551,Punjabi Zaika,"North Indian, Chinese, Mughlai"," Sector 23, Faridabad","Shawarma Rolls, Hummus, Grilled Chicken, Sweets, Meat, Roll",1552
1552,Middle East Cuisine,Middle Eastern," Sector 29, Gurgaon","Galawati Kebab, Seekh Kebab Roll, Masala Chaap, Dum Biryani, Paneer Roll, Butter Chicken",1553
1553,Lucknow Wale Kababi,"Lucknowi, Kebab, North Indian"," Sector 135, Noida","Reasonable Prices, Great Ambience, Nice Food, Cafe, Great Taste, Great Food",1554
1554,D Streat Cafe,"Italian, Sandwich, Fast Food, Desserts, Beverages"," Jangpura, New Delhi","Continental, Italian, Fast Food, North Indian, Beverages, Coffee",1555
1555,Coldpress Company,"Healthy Food, Juices, Salad"," Omaxe Gurgaon Mall, Gurgaon","Quality, Experience, Staff, Ambience, Service, Taste",1556
1556,The Desserts Factory,"Bakery, Desserts, Beverages"," Qutab Plaza, DLF Phase 1, Gurgaon","Paneer Lababdar, Chinese Food, Chaap, Cheesecake, Curry, Momos",1557
1557,Curry Ok,"North Indian, Chinese, Mughlai, Beverages"," Vikaspuri, New Delhi","Paneer Kofta Curry, Grilled Chicken Pizza, Kathi Rolls, Kheer, Dosa",1558
1558,Flavora,"Cafe, Continental, Italian, North Indian, Healthy Food"," Sector 57, Gurgaon","Customizable Dishes, Variety of Pizza, Weekend Brunch, Good Wifi, Family Crowd, Student Crowd",1559
1559,Brain Freezers,"Desserts, Ice Cream, Beverages, North Indian, Italian, Fast Food, Street Food"," NIT, Faridabad","Lachcha Paratha, Paneer Makhani, Parathas, Chutney, Dal Makhni",1560
1560,All India Parantha Trail,North Indian," Sector 22, Gurgaon",,1561
1561,Keshav Food Point,"Street Food, Fast Food, North Indian, Beverages"," NIT, Faridabad","Host, Concept, Best Place, Experience, Quality, Food",1562
1562,BBQ Ride,BBQ," Sector 49, Gurgaon","Good Food with Good Quantity, Good and Nice to Enjoy, Unlimited Refills, Drive through, Pocket Friendly, Office Crowd",1563
1563,Khushboo Vaishno Dhaba,North Indian," Model Town 3, New Delhi","Kurkure Momo, Mixed Sauce Pasta, Noodle, Spring Rolls, Sandwich, Momos",1564
1564,"Foodie Sip ""N"" Bite",Fast Food," Ashok Vihar Phase 3, New Delhi","Concept, Combo, Reasonable Price, Great Taste, Nice Place, Good Food",1565
1565,InstaDozza,South Indian," DLF Phase 3, Gurgaon","Brownie Nutella Waffles, Kitkat Waffle, Kit Kat Shake, Shake",1566
1566,Moffle Waffle,"Desserts, Fast Food, Beverages"," Jail Road, New Delhi","Chicken Spring Roll, Chicken Momo, Hakka Noodles, Manchurian, Honey Chilli Potato, Chilli Chicken",1567
1567,Chinese King,"Chinese, Momos"," Karol Bagh, New Delhi","Paneer Tikka Pizza, Veg Burger, Wrap, White Sauce Pasta, Chicken Burger, Sandwich",1568
1568,Grill Inn,"Fast Food, Sandwich, Burmese, Pizza, Italian, Wraps"," Janakpuri, New Delhi","Veg Roll, Chicken Fried Rice, Paneer Roll, Chicken Roll, Rolls, Noodles",1569
1569,Banjarabites,"Rolls, North Indian, Chinese, Beverages"," Beta 1, Greater Noida","Veg Sandwich, Deluxe Thali, Panneer Butter Masala, Kadhai Paneer, Shahi Paneer, Tandoori Chicken",1570
1570,Rotees n More,"North Indian, Chinese, Rolls, Momos, Mughlai"," Jaipuria Plaza, Sector 26, Noida, Noida","Veg Fried Rice, Veg Spring Rolls, Noodle, Chilli Potato",1571
1571,Mirch Masala Fast Food,"Chinese, Fast Food"," Gaur City 1, Greater Noida","Butter Chaap, Pan Fried Momos, Chicken Momo, Chicken Rara, Panner Tikka, Butter Roti",1572
1572,Spoon & Chopsticks,"Chinese, North Indian, Mughlai"," Sector 63, Noida","Proper Packaging, Great Portions, Spicy, Food Quality, Prices, Menu",1573
1573,The Punjabi Story,"North Indian, Mughlai, Chinese, Desserts"," Kalkaji, New Delhi","Packing, Awesome Food, Flavour, Food Quality, Good Food, Quantity",1574
1574,CURRYSUM,"North Indian, Mughlai, Chinese"," Sector 56, Gurgaon","Plenty of Vegetarian Options, Comfort Food, Casual Seating Area, Inexpensive, Prompt Service, Great Recommendations",1575
1575,JD's Peezza,"Pizza, Fast Food, Beverages, Burger, Sandwich"," Indirapuram, Ghaziabad","Chicken Supreme Burger, Chicken Tenders, Wraps, Burgers, Shake, Fries",1576
1576,Burger Stori,"Burger, Fast Food"," Sector 43, Gurgaon","Panneer Butter Masala, Chilli Potatoes, Kadhai Paneer, Butter Chicken, Dal Makhani, Sauce",1577
1577,The Food Arena,"North Indian, Chinese, Fast Food, Rolls"," Indirapuram, Ghaziabad","Peri Fries, Mixed Sauce Pasta, Juices, Maggi, Oreo Shake, Shakes",1578
1578,RC Fresh Juice Bar & Food Point,"Burger, Fast Food, Beverages, Juices"," Sector 7, Gurgaon","Classic Chicken Shawarma, Crispy Momos, French Fries, Snacks",1579
