,Restaurant_Name,Category,Locality,Known_For2,Id
0,Rustom's,"Parsi, Street Food, North Indian, Desserts, Beverages"," ITO, New Delhi",,1
1,Cafe Lota,"Cafe, South Indian, North Indian, Beverages"," Pragati Maidan, New Delhi","Pondicherry Fish Curry, Coconut Rabdi, Sabudana Pop Corn, Chicken Pasanda, Majestic Chicken, Bhapa Doi",2
2,Dum-Pukht - ITC Maurya,"Mughlai, North Indian, Desserts"," ITC Maurya, Chanakyapuri, New Delhi","Royal ambiance and Mughlai cuisine, also received the ""Times Food Award 2015"" for Culinary Heritage",3
3,Burma Burma,"Asian, Burmese, Bubble Tea, Desserts, Salad"," Cyber Hub, DLF Cyber City, Gurgaon","Coconut Milk Dessert, Honey Caviar, Kaffir Lime Cooler, Samosa Curry, Samosa Soup, Corn Curry",4
4,The Big Chill,"Continental, American, Italian"," Khan Market, New Delhi","Irish Cream Tiramisu, Penne Vodka, Mississippi Mudpie, Iced Tea Pitcher, Tuna Melt, Banofi Pie",5
5,Carnatic Cafe,South Indian," Lodhi Colony, New Delhi","Malleshwari Dosa, Benne Khali Dosa, Obbattu, Raagi Masala Dosa, Bombat Dosa, Puliyogare",6
6,"Cocktails & Dreams, Speakeasy","Nepalese, Tibetan, Beverages"," Sector 15, Gurgaon","Classic Martini, Coktails, Bloody Mary, Calamari, Bacon, Pork",7
7,Natural Ice Cream,"Ice Cream, Desserts"," Connaught Place, New Delhi","Watermelon Ice Cream, Choco Bite, Chocobite, Choco Almond, Roasted Almond Ice Cream, Tender Coconut Ice Cream",8
8,Kuremal Mohan Lal Kulfi Wale,"Ice Cream, Desserts"," Chawri Bazar, New Delhi","Orange Kulfi, Jamun Kulfi, Mixed Fruit, Fruit Cream, Ice Creams, Dessert",9
9,Juggernaut,"South Indian, North Indian, Fast Food, Desserts, Beverages"," Kailash Colony, New Delhi","Podi Ghee Idli, Chettinad Idli, Ganne Ka Ras, Pesarattu, Appalam, Chettinad Curry",10
10,Comorin,"North Indian, Desserts, Beverages"," Two Horizon Center, Golf Course Road, Gurgaon","Champaran Style Mutton, Gunpowder Idli, Coktails, Sev Puri, Haleem, Chocolate Dessert",11
11,Viet:Nom,"Vietnamese, Beverages"," Cyber Hub, DLF Cyber City, Gurgaon",,12
12,Cafeteria & Co.,"Cafe, Continental, Italian, Fast Food, Oriental, Beverages"," Vijay Nagar, New Delhi","Peri Peri Chicken Skewer, Tropical Heaven Sundae, Chicken Cannelloni, Banana Nutella Crepe, Chipotle Pizza, Blueberry Ice Cream",13
13,Sana-Di-Ge,"Mangalorean, Seafood, Goan, South Indian, North Indian, Kerala"," Chanakyapuri, New Delhi","Interiors and the outdoor seating , along with Seafood and authentic South Indian delicacies",14
14,Pa Pa Ya,"Asian, Chinese, Thai, Japanese, Sushi, Malaysian, Momos, Beverages"," Select Citywalk Mall, Saket, New Delhi",,15
15,Yum Yum Cha,"Asian, Japanese, Sushi, Desserts, Beverages, Rolls"," Cyber Hub, DLF Cyber City, Gurgaon","Spicy Basil Noodle, Takoyaki, Crispy Corn Cakes, Chilli Bowl, Sashimi Platter, Mochi Ice Cream",16
16,Coast Cafe,"Continental, Kerala"," Hauz Khas Village, New Delhi","Garam Curry Chicken, Aubergine Curry, Masala Fish Curry, Kerala Fish Fry, Kokum Curry, Avial",17
17,PizzaExpress,"Fast Food, Italian, Beverages, Desserts"," Ambience Mall, DLF Phase 3, Gurgaon",,18
18,The Big Chill Cakery,"Bakery, Desserts"," DLF Mall of India, Sector 18,  Noida, Noida","Triple Chocolate Cheesecake, Irish Tiramisu, Mushroom Tart, Irish Cream Coffee, Flaky Pastry, Mississippi Mud",19
19,Music & Mountains - Hillside Cafe,"Cafe, Italian, Continental, Fast Food, Salad, Beverages"," M Block Market, Greater Kailash 1 (GK1), New Delhi",,20
20,Gulati,"North Indian, Biryani, Hyderabadi, Mughlai, Kebab"," Pandara Road Market, New Delhi","Paneer Gilafi, Neza Kebab, Shahi Veg Platter, Handi Gosht, Methi Paneer, Hyderabadi Veg Biryani",21
21,Olive Bar & Kitchen,"Italian, Pizza, Mediterranean, Continental, European, Beverages, Desserts"," Mehrauli, New Delhi","Cheese Souffle, Fettucine, Scallops, Gnocchi, Sunday Brunches, Date Night",22
22,The Grammar Room,"Continental, Desserts, Beverages"," Mehrauli, New Delhi","Mushroom Melt, Spicy Fries, French Toast, Dessert Counter, Cookie, Mocha",23
23,Chaina Ram Sindhi Confectioners,"Mithai, Street Food"," Chandni Chowk, New Delhi","Sev Badam, Sohan Halwa, Pinni, Malai Ghewar, Poori Chole, Kaju Barfi",24
24,Sevilla - The Claridges,"Spanish, Italian, Desserts"," The Claridges, Aurangzeb Road, New Delhi","Patata Bravas, Corn Fed Chicken, Date Night, Duck, Risotto, Sangria",25
25,Bo Tai,"Thai, Japanese, Asian, Beverages"," Mehrauli, New Delhi",The restaurant uses Bamboo and Copper straws as eco-friendly alternatives.,26
26,Cafe Wink,"Cafe, Continental, Italian"," Anand Vihar, New Delhi","Bbq Spaghetti, Bbq Lasagna, Veg Omelette, Spaghetti Arrabiata, Pasta Al Forno, Exotica Garlic Bread",27
27,Spezia Bistro,"Pizza, Chinese, Momos, Fast Food, Italian, Beverages, Continental"," Delhi University-GTB Nagar, New Delhi","Baked Chicken Toscana, Spicy Mango Mojito, Classic Chicken Steak, Choco Ball, Mushroom Melt, Blueberry Pie",28
28,Evoo - Eatery And Pizzeria,"Cafe, Italian, Desserts, Beverages"," Geetanjali Enclave, New Delhi","Grilled Chicken Stuffed, Chocolate Orange, Lamb Shank, Gnocchi, Pepperoni Pizza, Tiramisu",29
29,Oh! Calcutta,"Bengali, Desserts"," Greater Kailash 2 (GK2), New Delhi",,30
30,Greenr Cafe,"Cafe, Italian, Mexican, Salad, Healthy Food, Desserts, Mediterranean","  32nd Avenue, NH8, Gurgaon, Gurgaon","A conscious and community oriented space, focussed on nutritive and processed-food-free vegetarianism. Engaging art and lifestyle workshops are an integral part of our experiential cafe.",31
31,Downtown - Diners & Living Beer Cafe,"Bar Food, North Indian, Fast Food, Italian, Chinese, Beverages"," Sector 29, Gurgaon","American Fried Chicken, Veg Farm Pizza, Strawberry Margarita, Vegetable Seekh, Dark Beer, Fattoush",32
32,Chili's Grill & Bar,"Mexican, Italian, American, Tex-Mex, Beverages, Desserts"," Pacific Mall, Tagore Garden, New Delhi","Molten Chocolate Chunk, Cajun Pasta, Smoked Chicken Leg, Santa Fe Salad, Tripple Dipper, Grilled Chicken Fajita",33
33,Theos,"Cafe, Desserts, Salad"," Sector 41, Noida",,34
34,Kuuraku,"Japanese, Sushi"," Global Foyer Mall, Golf Course Road, Gurgaon",,35
35,Threesixtyone Degrees - The Oberoi,"Asian, Continental, North Indian, Mughlai, Desserts, Beverages"," The Oberoi, Udyog Vihar, Gurgaon","Buffet, Chocolate Cake, Thai Curry, Salads, Virgin Mojito, Dimsums",36
36,Jom Jom Malay,"Asian, Malaysian, Thai, Chinese, Salad, Momos"," Saket, New Delhi",,37
37,Andrea's Eatery,"Asian, Italian, Beverages, Continental, Fast Food, Desserts"," Select Citywalk Mall, Saket, New Delhi","Katsu Chicken Curry, Spinach Ricotta Ravioli, Mushroom Lasagna, Butter Garlic Prawns, Jasmine Rice, Sauteed Vegetables",38
38,The Ivy,"Mediterranean, Lebanese, Continental, Desserts"," Baani Square, Sector 50, Gurgaon",,39
39,The Saffron Boutique,"North Indian, Mughlai, Chinese"," Hajipur, Noida",,40
40,Master Koii's,"Asian, Chinese, Thai, Malaysian, Korean"," Sushant Lok, Gurgaon","Balinese Chicken Satay, Cantonese Chilli Chicken, General Tsos Chicken, Korean Bibimbap, Burmese Chicken Curry, Korean Sushi",41
41,Kunzum Travel Cafe,Cafe," Hauz Khas Village, New Delhi","Brewed Coffee, Chocolate Cookies, Green Tea, Hot Coffee",42
42,Echoes Living Room,"Cafe, Continental, Chinese, Fast Food, Desserts, Beverages"," Subhash Nagar, New Delhi","Cafe, Continental, American, Italian, Mexican, Beverages",43
43,AMA Cafe,"Cafe, Continental, Desserts, Beverages"," Majnu ka Tila, New Delhi","Carrot Cinnamon, Pancakes and Maple Syrup, Pancake Breakfast, Choco Walnut Brownie, Banana Muffin, Apple Cinnamon Cake",44
44,Bukhara - ITC Maurya,"North Indian, Kebab"," ITC Maurya, Chanakyapuri, New Delhi","Sikanderi Raan, Meat Masala, Chicken Khurchan, Onion Kulcha, Jumbo Prawns, Firni",45
45,Leo's,"Pizza, Italian, Beverages"," Vasant Vihar, New Delhi","Pancetta Pizza, Pepperoni Pizza Pie, Parsley Butter, Prosciutto, Quattro Formaggio Pizza, Neapolitan Pizza",46
46,Pirates of Grill,"North Indian, Mughlai"," Ambience Mall, Vasant Kunj, New Delhi",,47
47,Roadhouse Cafe,"Cafe, Pizza, Italian, Wraps, Asian, Chinese, Thai, Beverages"," Greater Kailash 1 (GK1), New Delhi",,48
48,Plum By Bent Chair,"Chinese, Japanese, Thai, Asian, Beverages"," Aerocity, New Delhi","Elderflower Cocktail, Thai Mojito, Cappuccino Frappe, Turnip Cake, Honey Ice Cream, Peach Mocktail",49
49,Kiyan - The Roseate,"Thai, European, North Indian, Pizza, Salad"," The Roseate, Kapashera, New Delhi",,50
50,Dragonfly Experience,"Modern Indian, North Indian, Beverages, European, Asian, Desserts"," Worldmark 1, Aerocity, New Delhi",,51
51,AB's - Absolute Barbecues,"North Indian, Continental, Desserts, Salad"," MGF Metropolis Mall, MG Road, Gurgaon","Smoked Cottage Cheese, Chilli Chicken Wing, Chilli Ice Cream, Pineapple Grill, Masala Corn, Rabbit",52
52,Qureshi Kabab Corner,"Mughlai, Kebab"," Jama Masjid, New Delhi","Beef Kabab, Seekh Kebab Roll, Chicken Kabab, Kababs, Chicken Seekh, Rumali Roti",53
53,Clock Tower,"North Indian, Asian, Beverages, Fast Food"," Golf Course Road, Gurgaon",,54
54,Saravana Bhavan,"South Indian, Beverages"," Connaught Place, New Delhi","Kara Dosa, Rava Khichdi, Ghee Idli, Ghee Roast Paper Masala Dosa, Sweet Dahi Vada, Mini Idlies",55
55,C.I.A Call It Asiian,"Thai, Chinese, Sushi, Momos"," Greater Kailash 2 (GK2), New Delhi",,56
56,Open Tap,"Finger Food, North Indian, Continental, Italian"," South Point Mall, Golf Course Road, Gurgaon","Kamikaze, Chicken Bbq Wings, Chicken Slider, Craft Beer, Hummus Pita, Tawa Mutton",57
57,Hamoni: Cafe By The Greens,"Cafe, North Indian, Italian, Desserts, Beverages"," Sector 23, Gurgaon","Sizzler Brownie, Coffee Hazelnut, Cheese Balls, Hot Chocolate, Mezze Platter, Sunday Brunch",58
58,Indian Grill Room,"North Indian, Mughlai, Beverages, Kebab"," Suncity Business Tower, Golf Course Road, Gurgaon","Pineapple Jalebi, Ajwain Paneer Tikka, Gulkand Ki Kheer, Triffle Pudding, Tandoori Ananas, Blue Ocean Mocktail",59
59,Noida Social,"North Indian, Chinese, Burger, Rolls, Pizza, Momos, Continental, Beverages"," DLF Mall of India, Sector 18,  Noida, Noida","Cheesecake, Cocktails, Oreo Shake, Drink, Platter, Dessert",60
60,K3 - JW Marriott New Delhi,"North Indian, Chinese, Italian, Momos"," JW Marriott New Delhi, New Delhi","Dinner Buffet, Dessert Counter, Duck, Sunday Brunch, Dim Sums, Tiramisu",61
61,Barbeque Nation,"North Indian, BBQ, Beverages, Desserts"," Unity One Mall, Janakpuri, New Delhi","Grilled Shrimp, Cajun Potatoes, Matka Phirni, Pan Kulfi, Grilled Pineapple, Barbeque",62
62,Di Ghent Cafe,"European, Belgian"," Cross Point Mall, DLF Phase 4, Gurgaon","Yogurt Smoothie, Lamb Lasagna, Egg Benedict, Chicken Panini, Baguette, Smoked Salmon",63
63,Vapour Bar Exchange,"Continental, Italian, American, North Indian"," Sohna Road, Gurgaon",,64
64,Kiara Soul Kitchen,"Asian, North Indian, Oriental, Desserts, Juices, Beverages"," M Block Market, Greater Kailash 2 (GK2), New Delhi",,65
65,The Yellow Chilli,"North Indian, Mughlai, Chinese, Beverages, Desserts, Kebab"," Sector 110, Noida","Shyam Savera, Lalla Mussa Dal, Kurkuri Bhindi, Paneer Taka Tak, Dahi Kabab, Chilli Garlic Noodles",66
66,Mahabelly,"Kerala, South Indian, Seafood, Biryani"," DLF Avenue, Saket, New Delhi","Chicken Varattiyathu, Sweet Coconut Dosa, Mango Prawn Curry, Kothu Porotta, Pork Roast, Egg Appam",67
67,The Piano Man Jazz Club,"Finger Food, Mexican, American, Italian, Asian, Beverages"," Safdarjung, New Delhi",Balcony seating arrangement with live band perfomances,68
68,You Mee,"Japanese, Sushi, Asian, Chinese, Thai, Beverages"," Greater Kailash 2 (GK2), New Delhi","Matcha Cheesecake, Spider Roll, New Zealand Lamb Chops, Chicken Sushi, Chicken Gyoza, Sushi Platter",69
69,Delhi Club House,"North Indian, Continental, Asian"," Sangam Courtyard, RK Puram, New Delhi","Dak Bunglow Chicken Roast, Trifle Pudding, Amritsari Chhole, Chicken Cutlets, Apple Crumble, Galouti Kebab",70
70,Wenger's Deli,"Fast Food, Desserts, Beverages, North Indian, Pizza"," Connaught Place, New Delhi","Peri Peri Veg Panini, Mocha Smoothie, Veg Bbq Burger, Crunchy Chocolate, Blueberry Blast, Continental Breakfast",71
71,Farmer's Basket At Pluck,"Chinese, European, North Indian"," Pullman New Delhi Aerocity, Aerocity, New Delhi",,72
72,The Pasta Bowl Company,"Italian, Fast Food, Pizza, Pasta"," Cross Point Mall, DLF Phase 4, Gurgaon","Tortellini Puttanesca, Parma Ham Salad, Chicken Breast Sandwich, Spinach Ravioli, Ravioli Pasta, Orange Mojito",73
73,Chor Bizarre,"North Indian, Mughlai, Beverages"," Pandara Road Market, New Delhi","Khatte Baigan, Kashmiri Phirni, Tabakh Maaz, Dahi Batata Puri, Palak Patta Chat, Kulfi",74
74,Honk - Pullman New Delhi Aerocity,"Japanese, Chinese, Thai, Beverages"," Pullman New Delhi Aerocity, Aerocity, New Delhi",,75
75,Sakley's The Mountain Cafe,"Cafe, Italian, Fast Food"," DLF Galleria, DLF Phase 4, Gurgaon",,76
76,Cafe Diaries,"Cafe, Continental, Italian, Chinese, Mexican, Fast Food, Desserts, Beverages"," Satyaniketan, New Delhi",,77
77,Nando's,"Portuguese, Roast Chicken, Burger, Wraps, Salad"," Ambience Mall, DLF Phase 3, Gurgaon","Grill Chicken, Peri Peri Chicken, Hummus Pita, Peri Peri Sauce, Cheesecake, Chocolate Cake",78
78,Cafe Parmesan,"Italian, Pizza, Beverages"," Sector 15, Faridabad","Bacon Panini, Chocolate Torte, Belgian Choco Shake, Veg Panini, Ravioli, Chicken Lasagna",79
79,Nona's Kitchen,"North Indian, Mughlai, Rolls, Chinese, Kebab"," Supermart 1, DLF Phase 4, Gurgaon",,80
80,The Great Kabab Factory - Radisson Blu Plaza Delhi Airport,"North Indian, Mughlai, Kebab, Biryani, Desserts, Beverages"," Radisson Blu Plaza Delhi Airport, Mahipalpur, New Delhi","Set Menu, Dals, Galouti Kebab, Jalebi, Kababs, Kulfi",81
81,Wafflesome,"Desserts, Beverages"," Greater Kailash 1 (GK1), New Delhi","Brownie Nutella Waffles, Choco Waffle, Mango Waffle, Banana Toffee, Ice Cream Strawberry, Strawberry Waffle",82
82,Green House - The Beer Garden,"Continental, Tex-Mex, Mediterranean, North Indian, Asian"," Eros City Square Mall, Sector 49, Gurgaon, Gurgaon","Herbed Potato Wedges, Veg Ceaser Salad, Cheese Corn Nuggets, Spaghetti Bolognese, Wheat Beer, Chocolate Lava Cake",83
83,Big Wong,"Asian, Thai, Sushi, Poké, Chinese"," Sector 110, Noida",Assorted range of authentic Pan Asian food served in a cozy setting,84
84,La Pino'z Pizza,"Italian, Fast Food, Beverages, Desserts"," Raheja Mall, Sohna Road, Gurgaon",,85
85,The Hook,"Seafood, Continental, North Indian"," Sector 29, Gurgaon","Rusty Nail, Liit Cocktail, Soya Masala Chaap, Butter Garlic Prawns, Brewed Beer, Sea Food",86
86,Rahul Eggs,"Fast Food, Healthy Food, Street Food, North Indian"," Lawrence Road, New Delhi","Tandoori Jalandhari, Chicken Jalandhari, Eggs, Omelette",87
87,"Colocal ""The Cacao Artisans""","Cafe, Desserts, Continental, Coffee, Italian, Beverages"," Chhatarpur, New Delhi","Zucchini Fries, Garden Salad, Veg Tacos, Hot Chocolate, Bruschetta, Sangria",88
88,Farzi Cafe,"Mughlai, Finger Food, North Indian, Beverages"," Connaught Place, New Delhi",Modernized presentation of dishes with an elegant decor,89
89,The Drunken Botanist,"Continental, Italian, North Indian, Chinese"," Cyber Hub, DLF Cyber City, Gurgaon",,90
90,Jamun,"North Indian, Mughlai, Fast Food, Beverages"," Lodhi Colony, New Delhi",,91
91,Anardana: Modern Kitchen & Bar,"North Indian, Italian, Chinese, Beverages, Biryani, Mughlai, Kebab"," Karkardooma, New Delhi",,92
92,38 Barracks,"Finger Food, North Indian, Italian, Chinese, Continental, Pizza, Desserts, Beverages"," Connaught Place, New Delhi",,93
93,Rooh,"Modern Indian, Continental, Desserts"," Mehrauli, New Delhi",,94
94,Sly Granny,"Continental, American, Italian, European, Mexican, Desserts"," Khan Market, New Delhi","Biscuits and Gravy, Barley Salad, Tamarind Chicken, Lamb Bolognaise, Babaganush, Apple Crumble",95
95,Tamra - Shangri-La's - Eros Hotel,"North Indian, Continental, European, Asian, American, Desserts, Beverages"," Shangri-La's - Eros Hotel, Connaught Place, New Delhi",,96
96,Padmanabham,"South Indian, North Indian, Beverages, Desserts"," Janpath, New Delhi",,97
97,Manhattan Bar & Brewery,"Finger Food, American, Continental, North Indian, Italian, Beverages"," Global Foyer Mall, Golf Course Road, Gurgaon","Kiwi Blast, Brewed Wheat Beer, Chocolate Pan, Draft Beer, Garlic Bread with Cheese, Sev Puri",98
98,Brewocrat - Brewery Skybar & Kitchen,"Finger Food, Continental, Mediterranean, Italian, Asian"," Elements One Mall, Sector 49, Gurgaon",,99
99,Monkey Bar,"Pizza, Burger, Continental, Chinese, Fast Food, Beverages"," Vasant Kunj, New Delhi",Terrace Seating Ambiance And Good Range Of Alcohol - Below 25 years of age not allowed after 6 pm,100
100,Station Bar,"Chinese, Continental, North Indian, Mughlai, Fast Food, Beverages"," Connaught Place, New Delhi",,101
101,Rajinder Da Dhaba,"North Indian, Chinese, Mughlai"," Safdarjung, New Delhi","Makhmali Fish, Veg Malai Tikka, Gaulauti Kebab, Satay Chicken, Chicken Kalmi, Paneer Malai",102
102,The Imperial Spice,"North Indian, Continental, Mughlai, Street Food, Fast Food, Beverages"," Connaught Place, New Delhi",,103
103,The Turkey Project,"Cafe, Italian, American, Beverages"," Defence Colony, New Delhi",,104
104,ABB - Andrea's Bar & Brasserie,"Italian, Asian, European, Sushi, Thai, Salad, Pizza, Beverages"," Khan Market, New Delhi","Avocado Roll, Chocolate Dome, New Zealand Lamb Chops, Roasted Vegetables, Kafir Lime, New York Cheesecake",105
105,Spectra - The Leela Ambience,"North Indian, Continental, Oriental, Desserts, Beverages"," The Leela Ambience, DLF Phase 3, Gurgaon",,106
106,Perch Wine & Coffee Bar,"Beverages, European, Continental"," Khan Market, New Delhi","Double Chocolate Mousse, Coffee Bar, Potato Gnocchi, Mango Sorbet, Mulled Wine, Chicken Sub",107
107,Andhra Bhavan,"South Indian, Andhra"," Feroze Shah Road, New Delhi","Breakfast Thali, Unlimited Veg Thali, Sweet Pan, South Indian Meals, Gun Powder, Chicken Fry",108
108,BlackJack,"Fast Food, Beverages"," Punjabi Bagh, New Delhi","Spicy Cheesy Fries, Chocolate Ice Cream Shake, Chicken Juicy Burger, Nuttela Shake, Feta Cheese Salad, Cheesecake Shake",109
109,Jamie's Italian,"Italian, Pizza, Pasta, Desserts, Beverages"," Ambience Mall, Vasant Kunj, New Delhi",,110
110,Moonshine,"Finger Food, Continental, North Indian, Chinese"," Hauz Khas, New Delhi",,111
111,Bell Pepperz,"Chinese, Italian, North Indian, Kebab"," Ashok Vihar Phase 2, New Delhi",,112
112,Doodle's Garden,"North Indian, Continental, Asian, Beverages"," Punjabi Bagh, New Delhi",,113
113,Triveni Terrace Cafe,"Street Food, Desserts, Beverages"," Mandi House, New Delhi","Masala Cheese Toast, Coconut Curry Chicken, Pohaa, Ragi Idli, Paalak Patta Chaat, Gun Powder Idli",114
114,Mamagoto,"Asian, Chinese, Sushi, Desserts"," Select Citywalk Mall, Saket, New Delhi","Spicy Calamari, Spicy Bangkok Bowl, Kiwi Mint Cooler, Nutella Crunch, Spicy Ramen, Rock Shrimp Tempura",115
115,Lakhori - Haveli Dharampura,"Mughlai, Street Food, Kebab"," Chandni Chowk, New Delhi",Fly kites at the rooftop of Haveli Dharampura along with a lavish 3 course High Tea. It is breathtakingly beautiful to look at the sky covered with colorful kites from the Haveli rooftop...Read More,116
116,The Potbelly,"Bihari, Fast Food, Beverages"," Chanakyapuri, New Delhi","Dalpitti, Maithili Thali, Pudina Chicken Pulao, Tomato Chokha, Bhojpuri Thali, Madhubani Thali",117
117,SodaBottleOpenerWala,"Parsi, North Indian, Rolls, Street Food, Desserts, Beverages"," Khan Market, New Delhi","Parsi delicacies, Bombay street food, and Parsi themed ambiance",118
118,Al Nawaz Restaurant,"Mughlai, North Indian, Biryani, Kebab"," Jasola, New Delhi",,119
119,Open Tap,"Finger Food, North Indian, Chinese, Italian, Bar Food"," Sector 49, Gurgaon","Hunan Spicy Chicken, Tawa Mutton, Tandoori Non Veg Platter, Wheat Beer, Brewed Beer, Beers",120
120,64/6 -  Country Inn & Suites,"North Indian, Chinese, Thai, Continental"," Country Inn & Suites by Carlson, Sahibabad, Ghaziabad",,121
121,Punjab Grill,"North Indian, Mughlai, Biryani, Kebab, Desserts"," Pacific Mall, Tagore Garden, New Delhi","Veg Kurkuri, Meat Punjab Grill, Saag Gosht, Pan Shots, Murg Lababdar, Authentic Punjabi Food",122
122,Getafix,"American, Cafe, Healthy Food, Salad, Beverages, Italian, Desserts"," Cross Point Mall, DLF Phase 4, Gurgaon",,123
123,Ziu,"Asian, Thai, Chinese, Sushi, Japanese, Momos"," Sangam Courtyard, RK Puram, New Delhi",,124
124,AnnaMaya - Andaz Delhi,"North Indian, European, Beverages, Desserts"," Andaz Delhi, Aerocity, New Delhi",,125
125,Open Tap,"Bar Food, Oriental, Continental, Fast Food, North Indian, Beverages"," Sector 29, Gurgaon","Craft Beer, Brewed Beer, Dark Beer, Hot Wings, Beers, Mixed Sauce Pasta",126
126,Ricos,"Cafe, American, Italian, Mexican"," Delhi University-GTB Nagar, New Delhi","Virgin Sangria Pitcher, Roller Coaster Shake, Waffle Sunday, Apple Pie Shake, Chicken Chips, Cottage Cheese Fingers",127
127,The Reader's Cafe,"Cafe, Italian, Fast Food, Beverages, Desserts"," Indirapuram Habitat Centre, Indirapuram, Ghaziabad",,128
128,Pinch Of Spice,"North Indian, Chinese, Kebab, Mughlai, Italian"," Rajouri Garden, New Delhi",,129
129,Phonebooth Reloaded,"North Indian, Italian, Mexican, Continental"," Delhi University-GTB Nagar, New Delhi","Basil Roll, Volcano Pizza, Iced Lemon Tea, Blueberry Mojito, Stroganoff, Changezi Chicken",130
130,Kofuku,"Japanese, Asian, Sushi, Korean"," Ansal Plaza Mall, Khel Gaon Marg, New Delhi","We are happy to announce the amelioration of delectable Japanese Sunday Brunch with a wide spread of authentic Japanese delicacies including Soups, Salads, Sushi, Appetisers, Main course &...Read More",131
131,Tama Brewery & World Kitchen,"Fast Food, Chinese, Mughlai, North Indian, Beverages"," Sector 16, Faridabad","Hefeweizen, Brewed Wheat Beer, Thai Spring Roll, Fried Chicken Wings, Iced Peach Tea, Blueberry Cheese Cake",132
132,Theobroma,"Desserts, Bakery, Beverages"," Connaught Place, New Delhi","Devils Mousse Cake, Opium Pastry, Millionaire Brownie, Cookie Brownie, Overload Brownie, Cake in a Jar",133
133,Tonino,"Italian, Pizza, Pasta, Salad, Beverages"," MG Road, New Delhi","Chocolate Lasagne, Calamari, Ravioli, Date Night, Risotto, Tiramisu",134
134,Varq - The Taj Mahal Hotel,"Seafood, North Indian, Kebab"," The Taj Mahal Hotel, Mansingh Road, New Delhi","Get a complimentary night, earn up to 50% of spends as points at 250+ restaurants & much more. Know more",135
135,Feel Alive,"North Indian, Fast Food, Italian, Asian, Continental, Bar Food"," Sector 29, Gurgaon",,136
136,Punjabi Angithi,"North Indian, Chinese, Rolls, Fast Food, Momos"," Paschim Vihar, New Delhi","Bhuna Chaap Masala, Paneer Tikka Tandoori, Paneer Kurkure, Tawa Tikka Masala, Handi Paneer, Butter Garlic Noodles",137
137,Saundhee Potli,"Biryani, North Indian, Mughlai, Lucknowi, Kebab, Chinese, Rolls, Momos"," Indirapuram, Ghaziabad",,138
138,Raise The Bar Rooftop - Clarens Hotel,"European, Continental, Italian"," Clarens Hotel, Sector 29, Gurgaon, Gurgaon",,139
139,Dana Choga,"North Indian, Chinese, Mughlai"," Sector 14, Gurgaon",,140
140,Ji Memsaab - Indian Terrace Restaurant & Bar,"North Indian, Chinese, Mughlai, Continental, Asian, Italian, Beverages"," Eros City Square Mall, Sector 49, Gurgaon, Gurgaon","Paneer Tikka Pudina, Paneer Fritters, Tandoori Stuffed Mushroom, Dak Makhani, Rabri Faluda, Chicken 65",141
141,Karnataka Food Centre,"South Indian, Beverages"," R K Puram, New Delhi","Plain Masala Dosa, Mysore Pak, Sweet Pan, Filtered Coffee, Rava Kesari, Potato Filling",142
142,Kake Di Hatti,"North Indian, Beverages"," Chandni Chowk, New Delhi",Legendary North Indian restaurant in the heart of Old Delhi,143
143,Hawa Bar,"Fast Food, Italian, Chinese"," Sector 63, Noida",,144
144,Berco's,"Chinese, Thai, Asian, Beverages"," Hajipur, Noida","Shanghai Rice, Stir Fried Asian Greens, Black Pepper Paneer, Chilli Garlic Prawn, Chicken Honey, Spice Chicken",145
145,Crepe-fe,"Desserts, Fast Food, American, Beverages, Pizza, Ice Cream"," Ardee City, Gurgaon",,146
146,Mr. Crust Bakers,"Bakery, Burger, Fast Food, Beverages"," Vijay Nagar, New Delhi","Peach Pie, Veg Pattice, Fruit Pudding, Choco Chip Pastry, Makhani Pasta, Hazelnut Cold Coffee",147
147,The China Kitchen,"Chinese, Desserts"," Hyatt Regency, Bhikaji Cama Place, New Delhi","Peking Duck, Set Menu, Kung Pao Chicken, Dumplings, Dimsums, Soups",148
148,PCO,"Italian, Beverages, Fast Food, North Indian"," Vasant Vihar, New Delhi",,149
149,Decode Air Bar,"Modern Indian, Bar Food, Sushi, Italian, Asian"," Sector 29, Gurgaon","Pav Bhaji Cone, Beer Cocktail, Sauteed Vegetables, Chocolate Ball, Brewed Beer, Spicy Chicken",150
150,Giani's di Hatti,North Indian," Chandni Chowk, New Delhi","Rabri Falluda, Meethi Lassi, Chole Bhatoorey, Falooda, Fruit Cream, Rajma Chawal",151
151,Uptown Fresh Beer Cafe,"Finger Food, North Indian, Italian, European, Continental, Kebab, Momos"," DLF Galleria, DLF Phase 4, Gurgaon","Mozzarella Sticks, Wheat Beer, Lamb Chops, Beers, Pepperoni Pizza, Tiramisu",152
152,The Haven International Coffee House,"Cafe, Fast Food, Continental, Beverages, Desserts, Coffee"," Sector 72, Noida","Chicken Club Sandwiches, Coffees, Hot Chocolate, Latte, White Sauce Pasta, Brownie",153
153,Spago,Italian," Kasbah, Greater Kailash (GK) 1, New Delhi","Pasta Verdure, Feta Apple Salad, Bread Platter, Garlic Bread with Cheese, Tiramisu, Risotto",154
154,Cafe Amaretto,"Cafe, Italian, Continental, Bakery, Pizza, Desserts"," South Point Mall, Golf Course Road, Gurgaon",,155
155,Madrina,"North Indian, Chinese, Mughlai, Fast Food, Desserts"," Ashok Vihar Phase 2, New Delhi",,156
156,Naivedyam,South Indian," Hauz Khas Village, New Delhi","Kesari Bhath, Maharaja Dosa, Mysore Rava Masala Dosa, Dahi Idli, Rasam Papad, Ghee Roast Dosa",157
157,Friction The Drinkery,"Finger Food, North Indian, Continental, Thai, Italian, Chinese"," Sector 29, Gurgaon","Shahi Paneer Platter, Almond Shake, Tadka Maggi, Moscow Mule, Liit Cocktail, Veg Quesadillas",158
